81,,,,,,,,The Hi-Tech Gears Ltd,,,,,,,,,,,,,,,Kronox Lab Sciences Ltd,,,,,,,,,,,,,,,,,,,,,,Sharat Industries Ltd,,,JM Financial Ltd,,,,,,,,,,,,,,IRIS Business Services Ltd,RKEC Projects Ltd,,,,,,,,Radiant Cash Management Services Ltd,,,,,,,,,Neuland Laboratories Ltd,,,,,,,,,,,Valor Estate Ltd,,,,,,,,,,,Steelco Gujarat Ltd,,,,,,K-Lifestyle & Industries Ltd,,Rashi Peripherals Ltd,,,,
82,,,,,,,,Ucal Ltd,,,,,,,,,,,,,,,Laxmi Organic Industries Ltd,,,,,,,,,,,,,,,,,,,,,,Sheetal Cool Products Ltd,,,JSW Holdings Ltd,,,,,,,,,,,,,,IZMO Ltd,RPP Infra Projects Ltd,,,,,,,,Rain Industries Ltd,,,,,,,,,NGL Fine Chem Ltd,,,,,,,,,,,Vipul Ltd,,,,,,,,,,,Sunflag Iron & Steel Company Ltd,,,,,,Krishna Filament Industries Ltd,,Redington Ltd,,,,
83,,,,,,,,Ultra Wiring Connectivity Systems Ltd,,,,,,,,,,,,,,,Linde India Ltd,,,,,,,,,,,,,,,,,,,,,,Sheetal Universal Ltd,,,Kalyani Investment Company Ltd,,,,,,,,,,,,,,Kandarp Digi Smart BPO Ltd,Rulka Electricals Ltd,,,,,,,,Rajputana Biodiesel Ltd,,,,,,,,,Novartis India Ltd,,,,,,,,,,,,,,,,,,,,,,Supreme Engineering Ltd,,,,,,Kush Industries Ltd,,Refex Industries Ltd,,,,
84,,,,,,,,Uno Minda Ltd,,,,,,,,,,,,,,,Lords Chloro Alkali Ltd,,,,,,,,,,,,,,,,,,,,,,Shreeoswal Seeds & Chemicals Ltd,,,Keynote Financial Services Ltd,,,,,,,,,,,,,,Kellton Tech Solutions Ltd,Sadbhav Engineering Ltd,,,,,,,,RattanIndia Enterprises Ltd,,,,,,,,,Onyx Biotec Ltd,,,,,,,,,,,,,,,,,,,,,,Suraj Ltd,,,,,,Lagnam Spintex Ltd,,Rockingdeals Circular Economy Ltd,,,,
85,,,,,,,,Uravi Defence & Technology Ltd,,,,,,,,,,,,,,,Mahickra Chemicals Ltd,,,,,,,,,,,,,,,,,,,,,,SKM Egg Products Export (India) Ltd,,,Kirloskar Industries Ltd,,,,,,,,,,,,,,Kody Technolab Ltd,Sadbhav Infrastructure Projects Ltd,,,,,,,,Rites Ltd,,,,,,,,,Orchid Pharma Ltd,,,,,,,,,,,,,,,,,,,,,,Surani Steel Tubes Ltd,,,,,,Lakshmi Mills Company Ltd,,ROX Hi-Tech Ltd,,,,
86,,,,,,,,Varroc Engineering Ltd,,,,,,,,,,,,,,,Mangalam Organics Ltd,,,,,,,,,,,,,,,,,,,,,,Sonal Cosmetics (Exports) Ltd,,,KJMC Financial Services Ltd,,,,,,,,,,,,,,KPIT Technologies Ltd,Salasar Exteriors & Contour Ltd,,,,,,,,Ruchi Infrastructure Ltd,,,,,,,,,Ortin Global Ltd,,,,,,,,,,,,,,,,,,,,,,Surya Roshni Ltd,,,,,,Lambodhara Textiles Ltd,,State Trading Corporation of India Ltd,,,,
87,,,,,,,,Wheels India Ltd,,,,,,,,,,,,,,,Narmada Gelatines Ltd,,,,,,,,,,,,,,,,,,,,,,Srivari Spices & Foods Ltd,,,L&T Finance Ltd,,,,,,,,,,,,,,Ksolves India Ltd,Sathlokhar Synergys E&C Global Ltd,,,,,,,,Rudrabhishek Enterprises Ltd,,,,,,,,,Procter & Gamble Health Ltd,,,,,,,,,,,,,,,,,,,,,,Swastik Pipe Ltd,,,,,,Laxmi Cotspin Ltd,,Sakuma Exports Ltd,,,,
88,,,,,,,,Z F Steering Gear (India) Ltd,,,,,,,,,,,,,,,National Oxygen Ltd,,,,,,,,,,,,,,,,,,,,,,Sukhjit Starch & Chemicals Ltd,,,Lakshmi Finance & Industrial Corporation Ltd,,,,,,,,,,,,,,L&T Technology Services Ltd,Semac Consultants Ltd,,,,,,,,Rushil Decor Ltd Partly Paidup,,,,,,,,,Panacea Biotec Ltd,,,,,,,,,,,,,,,,,,,,,,Tata Steel Ltd,,,,,,Lorenzini Apparels Ltd,,Saraswati Saree Depot Ltd,,,,
89,,,,,,,,ZF Commercial Vehicle Control System India Ltd,,,,,,,,,,,,,,,Navin Fluorine International Ltd,,,,,,,,,,,,,,,,,,,,,,Tapi Fruit Processing Ltd,,,LIC Housing Finance Ltd,,,,,,,,,,,,,,Latent View Analytics Ltd,SEPC Ltd,,,,,,,,S.S. Infrastructure Development Consultants Ltd,,,,,,,,,Panchsheel Organics Ltd,,,,,,,,,,,,,,,,,,,,,,Tata Steel BSL Ltd(Merged),,,,,,Lovable Lingerie Ltd,,Sarthak Industries Ltd,,,,
90,,,,,,,,,,,,,,,,,,,,,,,Neogen Chemicals Ltd,,,,,,,,,,,,,,,,,,,,,,Tasty Bite Eatables Ltd,,,LKP Finance Ltd,,,,,,,,,,,,,,LTIMindtree Ltd,Simplex Infrastructures Ltd,,,,,,,,Sanghvi Movers Ltd,,,,,,,,,Par Drugs & Chemicals Ltd,,,,,,,,,,,,,,,,,,,,,,Tata Steel Ltd Partly Paid Up,,,,,,Loyal Textile Mills Ltd,,Shankar Lal Rampal Dye-Chem Ltd,,,,
91,,,,,,,,,,,,,,,,,,,,,,,Nitta Gelatin India Ltd,,,,,,,,,,,,,,,,,,,,,,TBI Corn Ltd,,,Mahindra & Mahindra Financial Services Ltd,,,,,,,,,,,,,,Magellanic Cloud Ltd,Sonu Infratech Ltd,,,,,,,,SEAMEC Ltd,,,,,,,,,Parenteral Drugs (India) Ltd,,,,,,,,,,,,,,,,,,,,,,Technocraft Industries (India) Ltd,,,,,,Lux Industries Ltd,,Shanthala FMCG Products Ltd,,,,
92,,,,,,,,,,,,,,,,,,,,,,,NOCIL Ltd,,,,,,,,,,,,,,,,,,,,,,The Ravalgaon Sugar Farm Ltd,,,Maharashtra Scooters Ltd,,,,,,,,,,,,,,Mastek Ltd,SPML Infra Ltd,,,,,,,,SecUR Credentials Ltd,,,,,,,,,Pfizer Ltd,,,,,,,,,,,,,,,,,,,,,,Tube Investments of India Ltd,,,,,,Mahaalaxmi Texpro Ltd,,Shiv Aum Steels Ltd,,,,
93,,,,,,,,,,,,,,,,,,,,,,,OCCL Ltd,,,,,,,,,,,,,,,,,,,,,,Umang Dairies Ltd,,,Maha Rashtra Apex Corporation Ltd,,,,,,,,,,,,,,Melstar Information Technologies Ltd,SRM Contractors Ltd,,,,,,,,Service Care Ltd,,,,,,,,,Piramal Pharma Ltd,,,,,,,,,,,,,,,,,,,,,,Tulsyan NEC Ltd,,,,,,Mahalaxmi Fabric Mills Ltd,,Shrenik Ltd,,,,
94,,,,,,,,,,,,,,,,,,,,,,,Omkar Speciality Chemicals Ltd,,,,,,,,,,,,,,,,,,,,,,Universus Photo Imagings Ltd,,,Manappuram Finance Ltd,,,,,,,,,,,,,,Micropro Software Solutions Ltd,Sterling & Wilson Renewable Energy Ltd,,,,,,,,Shipping Corporation of India Land & Assets Ltd,,,,,,,,,Quest Laboratories Ltd,,,,,,,,,,,,,,,,,,,,,,Usha Martin Ltd,,,,,,Mahalaxmi Rubtech Ltd,,Shubhlaxmi Jewel Art Ltd,,,,
95,,,,,,,,,,,,,,,,,,,,,,,Oriental Aromatics Ltd,,,,,,,,,,,,,,,,,,,,,,Upsurge Seeds of Agriculture Ltd,,,Manba Finance Ltd,,,,,,,,,,,,,,Mindpool Technologies Ltd,Supreme Infrastructure India Ltd,,,,,,,,Shree OSFM E-Mobility Ltd,,,,,,,,,Remus Pharmaceuticals Ltd,,,,,,,,,,,,,,,,,,,,,,Vardhman Special Steels Ltd,,,,,,Mallcom (India) Ltd,,Shyam Telecom Ltd,,,,
96,,,,,,,,,,,,,,,,,,,,,,,Paragon Fine and Speciality Chemical Ltd,,,,,,,,,,,,,,,,,,,,,,Vadilal Industries Ltd,,,Mangal Credit & Fincorp Ltd,,,,,,,,,,,,,,Mindteck (India) Ltd,Tarmat Ltd,,,,,,,,Shree Rama Newsprint Ltd,,,,,,,,,RPG Life Sciences Ltd,,,,,,,,,,,,,,,,,,,,,,Vaswani Industries Ltd,,,,,,Manomay Tex India Ltd,,Sicagen India Ltd,,,,
97,,,,,,,,,,,,,,,,,,,,,,,PCBL Chemical Ltd,,,,,,,,,,,,,,,,,,,,,,Varun Beverages Ltd,,,MAS Financial Services Ltd,,,,,,,,,,,,,,Mindtree Ltd,Techno Electric & Engineering Company Ltd,,,,,,,,Shubhshree Biofuels Energy Ltd,,,,,,,,,Sai Life Sciences Ltd,,,,,,,,,,,,,,,,,,,,,,Venus Pipes & Tubes Ltd,,,,,,Maral Overseas Ltd,,Signet Industries Ltd,,,,
98,,,,,,,,,,,,,,,,,,,,,,,Petro Carbon & Chemicals Ltd,,,,,,,,,,,,,,,,,,,,,,Venkys (India) Ltd,,,Mask Investments Ltd,,,,,,,,,,,,,,Moschip Technologies Ltd,Technofab Engineering Ltd,,,,,,,,Siddhika Coatings Ltd,,,,,,,,,Sakar Healthcare Ltd,,,,,,,,,,,,,,,,,,,,,,Vibhor Steel Tubes Ltd,,,,,,Marvel Decor Ltd,,Silkflex Polymers (India) Ltd,,,,
99,,,,,,,,,,,,,,,,,,,,,,,Pidilite Industries Ltd,,,,,,,,,,,,,,,,,,,,,,Vikas Proppant & Granite Ltd,,,Master Trust Ltd,,,,,,,,,,,,,,Mphasis Ltd,Teerth Gopicon Ltd,,,,,,,,Signpost India Ltd,,,,,,,,,Sanofi Consumer Healthcare India Ltd,,,,,,,,,,,,,,,,,,,,,,Vilas Transcore Ltd,,,,,,Modern Denim Ltd,,Sirca Paints India Ltd,,,,
100,,,,,,,,,,,,,,,,,,,,,,,Plastiblends India Ltd,,,,,,,,,,,,,,,,,,,,,,Vishwas Agri Seeds Ltd,,,Max Financial Services Ltd,,,,,,,,,,,,,,MPS Ltd,Transrail Lighting Ltd,,,,,,,,SIS Ltd,,,,,,,,,Sanofi India Ltd,,,,,,,,,,,,,,,,,,,,,,Vraj Iron & Steel Ltd,,,,,,Modern Syntex (India) Ltd,,Soma Textiles & Industries Ltd,,,,
101,,,,,,,,,,,,,,,,,,,,,,,Platinum Industries Ltd,,,,,,,,,,,,,,,,,,,,,,Waterbase Ltd,,,Max India Ltd,,,,,,,,,,,,,,Network People Services Technologies Ltd,Twamev Constructions & Infrastructure Ltd,,,,,,,,SORIL Infra Resources Ltd(Merged),,,,,,,,,Sat Kartar Shopping Ltd,,,,,,,,,,,,,,,,,,,,,,Welspun Corp Ltd,,,,,,Modern Threads (I) Ltd,,Spacenet Enterprises India Ltd,,,,
102,,,,,,,,,,,,,,,,,,,,,,,Poddar Pigments Ltd,,,,,,,,,,,,,,,,,,,,,,Yash Optics & Lens Ltd,,,McDowell Holdings Ltd,,,,,,,,,,,,,,Newgen Software Technologies Ltd,UBE Industries Ltd,,,,,,,,Starlog Enterprises Ltd,,,,,,,,,Senores Pharmaceuticals Ltd,,,,,,,,,,,,,,,,,,,,,,Welspun Specialty Solutions Ltd,,,,,,Mohit Industries Ltd,,SPL Industries Ltd,,,,
103,,,,,,,,,,,,,,,,,,,,,,,Polychem Ltd,,,,,,,,,,,,,,,,,,,,,,Zydus Wellness Ltd,,,Mufin Green Finance Ltd,,,,,,,,,,,,,,NINtec Systems Ltd,Udayshivakumar Infra Ltd,,,,,,,,Super Spinning Mills Ltd,,,,,,,,,Sequent Scientific Ltd,,,,,,,,,,,,,,,,,,,,,,Zenith Steel Pipes & Industries Ltd,,,,,,Momai Apparels Ltd,,Sreeleathers Ltd,,,,
104,,,,,,,,,,,,,,,,,,,,,,,Premier Explosives Ltd,,,,,,,,,,,,,,,,,,,,,,,,,Muthoot Capital Services Ltd,,,,,,,,,,,,,,Nucleus Software Exports Ltd,Univastu India Ltd,,,,,,,,Supreme Facility Management Ltd,,,,,,,,,Shilpa Medicare Ltd,,,,,,,,,,,,,,,,,,,,,,,,,,,,Monte Carlo Fashions Ltd,,Standard Batteries Ltd,,,,
105,,,,,,,,,,,,,,,,,,,,,,,Primo Chemicals Ltd,,,,,,,,,,,,,,,,,,,,,,,,,Muthoot Finance Ltd,,,,,,,,,,,,,,One Point One Solutions Ltd,V.L.Infraprojects Ltd,,,,,,,,SVC Industries Ltd,,,,,,,,,Sigachi Industries Ltd,,,,,,,,,,,,,,,,,,,,,,,,,,,,Morarjee Textiles Ltd,,Standard Industries Ltd,,,,
106,,,,,,,,,,,,,,,,,,,,,,,Privi Speciality Chemicals Ltd,,,,,,,,,,,,,,,,,,,,,,,,,Muthoot Microfin Ltd,,,,,,,,,,,,,,Onward Technologies Ltd,Va Tech Wabag Ltd,,,,,,,,Sylvan Plyboard (India) Ltd,,,,,,,,,SMS Lifesciences India Ltd,,,,,,,,,,,,,,,,,,,,,,,,,,,,Nagreeka Exports Ltd,,Suumaya Industries Ltd,,,,
107,,,,,,,,,,,,,,,,,,,,,,,Prolife Industries Ltd,,,,,,,,,,,,,,,,,,,,,,,,,My Mudra Fincorp Ltd,,,,,,,,,,,,,,Oracle Financial Services Software Ltd,Vindhya Telelinks Ltd,,,,,,,,Talwalkars Better value Fitness Ltd,,,,,,,,,SMS Pharmaceuticals Ltd,,,,,,,,,,,,,,,,,,,,,,,,,,,,Nahar Industrial Enterprises Ltd,,Swiss Military Consumer Goods Ltd,,,,
108,,,,,,,,,,,,,,,,,,,,,,,Rite Zone Chemcon India Ltd,,,,,,,,,,,,,,,,,,,,,,,,,Naga Dhunseri Group Ltd,,,,,,,,,,,,,,Orchasp Ltd,Vishnu Prakash R Punglia Ltd,,,,,,,,Talwalkars Healthclubs Ltd,,,,,,,,,Solara Active Pharma Sciences Ltd,,,,,,,,,,,,,,,,,,,,,,,,,,,,Nahar Spinning Mills Ltd,,Tainwala Chemicals & Plastics (India) Ltd,,,,
109,,,,,,,,,,,,,,,,,,,,,,,Rossari Biotech Ltd,,,,,,,,,,,,,,,,,,,,,,,,,Nagreeka Capital & Infrastructure Ltd,,,,,,,,,,,,,,Orient Technologies Ltd,W S Industries (India) Ltd,,,,,,,,Team Lease Services Ltd,,,,,,,,,Solara Active Pharma Sciences Ltd Partly Paidup,,,,,,,,,,,,,,,,,,,,,,,,,,,,Nakoda Ltd,,Tembo Global Industries Ltd,,,,
110,,,,,,,,,,,,,,,,,,,,,,,S H Kelkar & Company Ltd,,,,,,,,,,,,,,,,,,,,,,,,,Nahar Capital & Financial Services Ltd,,,,,,,,,,,,,,Paramatrix Technologies Ltd,Welspun Enterprises Ltd,,,,,,,,Thomas Cook (India) Ltd,,,,,,,,,Sotac Pharmaceuticals Ltd,,,,,,,,,,,,,,,,,,,,,,,,,,,,Nandan Denim Ltd,,Uma Exports Ltd,,,,
111,,,,,,,,,,,,,,,,,,,,,,,Sadhana Nitro Chem Ltd,,,,,,,,,,,,,,,,,,,,,,,,,Nalwa Sons Investments Ltd,,,,,,,,,,,,,,PB Fintech Ltd,Winsol Engineers Ltd,,,,,,,,Transchem Ltd,,,,,,,,,Sun Pharma Advanced Research Company Ltd,,,,,,,,,,,,,,,,,,,,,,,,,,,,Nandani Creation Ltd,,Uniphos Enterprises Ltd,,,,
112,,,,,,,,,,,,,,,,,,,,,,,Sanginita Chemicals Ltd,,,,,,,,,,,,,,,,,,,,,,,,,Naperol Investments Ltd,,,,,,,,,,,,,,Pelatro Ltd,Zodiac Energy Ltd,,,,,,,,Uniply Industries Ltd,,,,,,,,,Strides Pharma Science Ltd,,,,,,,,,,,,,,,,,,,,,,,,,,,,Neelam Linens and Garments (India) Ltd,,Uniworth International Ltd,,,,
113,,,,,,,,,,,,,,,,,,,,,,,Saroja Pharma Industries India Ltd,,,,,,,,,,,,,,,,,,,,,,,,,NBI Industrial Finance Company Ltd,,,,,,,,,,,,,,Pentamedia Graphics Ltd,,,,,,,,,Updater Services Ltd,,,,,,,,,Sun Pharmaceuticals Industries Ltd,,,,,,,,,,,,,,,,,,,,,,,,,,,,Nitin Spinners Ltd,,Urja Global Ltd Partly Paidup,,,,
114,,,,,,,,,,,,,,,,,,,,,,,Seya Industries Ltd,,,,,,,,,,,,,,,,,,,,,,,,,NDL Ventures Ltd,,,,,,,,,,,,,,Persistent Systems Ltd,,,,,,,,,Urban Enviro Waste Management Ltd,,,,,,,,,Sunrest Lifescience Ltd,,,,,,,,,,,,,,,,,,,,,,,,,,,,Orbit Exports Ltd,,Utique Enterprises Ltd,,,,
115,,,,,,,,,,,,,,,,,,,,,,,Shree Pushkar Chemicals & Fertilizers Ltd,,,,,,,,,,,,,,,,,,,,,,,,,Nippon Life India Asset Management Ltd,,,,,,,,,,,,,,Plada Infotech Services Ltd,,,,,,,,,Veritaas Advertising Ltd,,,,,,,,,Supriya Lifescience Ltd,,,,,,,,,,,,,,,,,,,,,,,,,,,,Paramount Dye Tec Ltd,,Vasa Retail and Overseas Ltd,,,,
116,,,,,,,,,,,,,,,,,,,,,,,Sree Rayalaseema Hi-Strength Hypo Ltd,,,,,,,,,,,,,,,,,,,,,,,,,Northern ARC Capital Ltd,,,,,,,,,,,,,,Protean eGov Technologies Ltd,,,,,,,,,Voler Car Ltd,,,,,,,,,Suven Pharmaceuticals Ltd,,,,,,,,,,,,,,,,,,,,,,,,,,,,Paras Petrofils Ltd,,Venlon Enterprises Ltd,,,,
117,,,,,,,,,,,,,,,,,,,,,,,SRF Ltd,,,,,,,,,,,,,,,,,,,,,,,,,Onelife Capital Advisors Ltd,,,,,,,,,,,,,,Quadpro ITeS Ltd,,,,,,,,,,,,,,,,,,Syncom Formulations (India) Ltd,,,,,,,,,,,,,,,,,,,,,,,,,,,,Pashupati Cotspin Ltd,,Vikas Lifecare Ltd Partly Paidup,,,,
118,,,,,,,,,,,,,,,,,,,,,,,Stallion India Fluorochemicals Ltd,,,,,,,,,,,,,,,,,,,,,,,,,Oriental Carbon & Chemicals Ltd,,,,,,,,,,,,,,Quick Heal Technologies Ltd,,,,,,,,,,,,,,,,,,Themis Medicare Ltd,,,,,,,,,,,,,,,,,,,,,,,,,,,,Pasupati Acrylon Ltd,,Vikas Lifecare Ltd,,,,
119,,,,,,,,,,,,,,,,,,,,,,,Sudarshan Chemical Industries Ltd,,,,,,,,,,,,,,,,,,,,,,,,,Oswal Green Tech Ltd,,,,,,,,,,,,,,Quintegra Solutions Ltd,,,,,,,,,,,,,,,,,,Torrent Pharmaceuticals Ltd,,,,,,,,,,,,,,,,,,,,,,,,,,,,Pasupati Spinning & Weaving Mills Ltd,,Vinyl Chemicals (I) Ltd,,,,
120,,,,,,,,,,,,,,,,,,,,,,,Tanfac Industries Ltd,,,,,,,,,,,,,,,,,,,,,,,,,Paisalo Digital Ltd,,,,,,,,,,,,,,R S Software (India) Ltd,,,,,,,,,,,,,,,,,,Unichem Laboratories Ltd,,,,,,,,,,,,,,,,,,,,,,,,,,,,Patspin India Ltd,,Visagar Polytex Ltd,,,,
121,,,,,,,,,,,,,,,,,,,,,,,Tata Chemicals Ltd,,,,,,,,,,,,,,,,,,,,,,,,,Palash Securities Ltd,,,,,,,,,,,,,,R Systems International Ltd,,,,,,,,,,,,,,,,,,Vaishali Pharma Ltd,,,,,,,,,,,,,,,,,,,,,,,,,,,,Pioneer Embroideries Ltd,,Visaman Global Sales Ltd,,,,
122,,,,,,,,,,,,,,,,,,,,,,,Tatva Chintan Pharma Chem Ltd,,,,,,,,,,,,,,,,,,,,,,,,,Pan India Corporation Ltd,,,,,,,,,,,,,,Ramco Systems Ltd,,,,,,,,,,,,,,,,,,Valiant Laboratories Ltd,,,,,,,,,,,,,,,,,,,,,,,,,,,,Prag Bosimi Synthetics Ltd,,Vishal Mega Mart Ltd,,,,
123,,,,,,,,,,,,,,,,,,,,,,,TECIL Chemical & Hydro Power Ltd,,,,,,,,,,,,,,,,,,,,,,,,,Pilani Investment & Industries Corporation Ltd,,,,,,,,,,,,,,Rategain Travel Technologies Ltd,,,,,,,,,,,,,,,,,,Veerhealth Care Ltd,,,,,,,,,,,,,,,,,,,,,,,,,,,,Precot Ltd,,Vision Infra Equipment Solutions Ltd,,,,
124,,,,,,,,,,,,,,,,,,,,,,,TGV Sraac Ltd,,,,,,,,,,,,,,,,,,,,,,,,,Piramal Enterprises Ltd,,,,,,,,,,,,,,Reliable Data Services Ltd,,,,,,,,,,,,,,,,,,Venus Remedies Ltd,,,,,,,,,,,,,,,,,,,,,,,,,,,,Raj Rayon Industries Ltd,,WOL 3D India Ltd,,,,
125,,,,,,,,,,,,,,,,,,,,,,,Thirumalai Chemicals Ltd,,,,,,,,,,,,,,,,,,,,,,,,,PNB Gilts Ltd,,,,,,,,,,,,,,Rolta India Ltd,,,,,,,,,,,,,,,,,,Vilin Bio Med Ltd,,,,,,,,,,,,,,,,,,,,,,,,,,,,Rajapalayam Mills Ltd,,Xedd Telecom Ltd,,,,
126,,,,,,,,,,,,,,,,,,,,,,,Transpek Industry Ltd,,,,,,,,,,,,,,,,,,,,,,,,,PNB Housing Finance Ltd,,,,,,,,,,,,,,Route Mobile Ltd,,,,,,,,,,,,,,,,,,Vineet Laboratories Ltd,,,,,,,,,,,,,,,,,,,,,,,,,,,,Rajvir Industries Ltd,,,,,,
127,,,,,,,,,,,,,,,,,,,,,,,Tuticorin Alkali Chemicals & Fertilizers Ltd,,,,,,,,,,,,,,,,,,,,,,,,,Poonawalla Fincorp Ltd,,,,,,,,,,,,,,RPSG Ventures Ltd,,,,,,,,,,,,,,,,,,Vivimed Labs Ltd,,,,,,,,,,,,,,,,,,,,,,,,,,,,Raymond Lifestyle Ltd,,,,,,
128,,,,,,,,,,,,,,,,,,,,,,,Ultramarine & Pigments Ltd,,,,,,,,,,,,,,,,,,,,,,,,,Power Finance Corporation Ltd,,,,,,,,,,,,,,S A Tech Software India Ltd,,,,,,,,,,,,,,,,,,Walpar Nutritions Ltd,,,,,,,,,,,,,,,,,,,,,,,,,,,,Reliance Chemotex Industries Ltd,,,,,,
129,,,,,,,,,,,,,,,,,,,,,,,Unilex Colour & Chemical Ltd,,,,,,,,,,,,,,,,,,,,,,,,,Prime Securities Ltd,,,,,,,,,,,,,,Sagility India Ltd,,,,,,,,,,,,,,,,,,Wanbury Ltd,,,,,,,,,,,,,,,,,,,,,,,,,,,,RSWM Ltd,,,,,,
130,,,,,,,,,,,,,,,,,,,,,,,Ushanti Colour Chem Ltd,,,,,,,,,,,,,,,,,,,,,,,,,Prithvi Exchange (India) Ltd,,,,,,,,,,,,,,Sahana Systems Ltd,,,,,,,,,,,,,,,,,,Windlas Biotech Ltd,,,,,,,,,,,,,,,,,,,,,,,,,,,,Ruby Mills Ltd,,,,,,
131,,,,,,,,,,,,,,,,,,,,,,,Vadivarhe Speciality Chemicals Ltd,,,,,,,,,,,,,,,,,,,,,,,,,PTC India Financial Services Ltd,,,,,,,,,,,,,,Saksoft Ltd,,,,,,,,,,,,,,,,,,Wockhardt Ltd,,,,,,,,,,,,,,,,,,,,,,,,,,,,S D Retail Ltd,,,,,,
132,,,,,,,,,,,,,,,,,,,,,,,Valiant Organics Ltd,,,,,,,,,,,,,,,,,,,,,,,,,Rane Holdings Ltd,,,,,,,,,,,,,,Sasken Technologies Ltd,,,,,,,,,,,,,,,,,,Zenith Drugs Ltd,,,,,,,,,,,,,,,,,,,,,,,,,,,,S P Apparels Ltd,,,,,,
133,,,,,,,,,,,,,,,,,,,,,,,Veedol Corporation Ltd,,,,,,,,,,,,,,,,,,,,,,,,,REC Ltd,,,,,,,,,,,,,,Secmark Consultancy Ltd,,,,,,,,,,,,,,,,,,Zim Laboratories Ltd,,,,,,,,,,,,,,,,,,,,,,,,,,,,Sahaj Fashions Ltd,,,,,,
134,,,,,,,,,,,,,,,,,,,,,,,Vidhi Specialty Food Ingredients Ltd,,,,,,,,,,,,,,,,,,,,,,,,,Reliance Home Finance Ltd,,,,,,,,,,,,,,SecureKloud Technologies Ltd,,,,,,,,,,,,,,,,,,Zota Health Care Ltd,,,,,,,,,,,,,,,,,,,,,,,,,,,,Salona Cotspin Ltd,,,,,,
135,,,,,,,,,,,,,,,,,,,,,,,Vikas Wsp Ltd,,,,,,,,,,,,,,,,,,,,,,,,,Religare Enterprises Ltd,,,,,,,,,,,,,,Sigma Solve Ltd,,,,,,,,,,,,,,,,,,Zydus Lifesciences Ltd,,,,,,,,,,,,,,,,,,,,,,,,,,,,Sambandam Spinning Mills Ltd,,,,,,
136,,,,,,,,,,,,,,,,,,,,,,,Vinati Organics Ltd,,,,,,,,,,,,,,,,,,,,,,,,,Repco Home Finance Ltd,,,,,,,,,,,,,,Silver Touch Technologies Ltd,,,,,,,,,,,,,,,,,,,,,,,,,,,,,,,,,,,,,,,,,,,,,,Sanathan Textiles Ltd,,,,,,
137,,,,,,,,,,,,,,,,,,,,,,,Vishnu Chemicals Ltd,,,,,,,,,,,,,,,,,,,,,,,,,Sakthi Finance Ltd,,,,,,,,,,,,,,Silverline Technologies Ltd,,,,,,,,,,,,,,,,,,,,,,,,,,,,,,,,,,,,,,,,,,,,,,Sangam (India) Ltd,,,,,,
138,,,,,,,,,,,,,,,,,,,,,,,Vital Chemtech Ltd,,,,,,,,,,,,,,,,,,,,,,,,,Sammaan Capital Ltd,,,,,,,,,,,,,,Softtech Engineers Ltd,,,,,,,,,,,,,,,,,,,,,,,,,,,,,,,,,,,,,,,,,,,,,,Sarla Performance Fibers Ltd,,,,,,
139,,,,,,,,,,,,,,,,,,,,,,,Yasho Industries Ltd,,,,,,,,,,,,,,,,,,,,,,,,,Sammaan Capital Ltd Partly Paidup,,,,,,,,,,,,,,Sonata Software Ltd,,,,,,,,,,,,,,,,,,,,,,,,,,,,,,,,,,,,,,,,,,,,,,SBC Exports Ltd,,,,,,
140,,,,,,,,,,,,,,,,,,,,,,,Yasons Chemex Care Ltd,,,,,,,,,,,,,,,,,,,,,,,,,Sastasundar Ventures Ltd,,,,,,,,,,,,,,Subex Ltd,,,,,,,,,,,,,,,,,,,,,,,,,,,,,,,,,,,,,,,,,,,,,,SEL Manufacturing Company Ltd,,,,,,
141,,,,,,,,,,,,,,,,,,,,,,,,,,,,,,,,,,,,,,,,,,,,,,,,Satin Creditcare Network Ltd,,,,,,,,,,,,,,Synoptics Technologies Ltd,,,,,,,,,,,,,,,,,,,,,,,,,,,,,,,,,,,,,,,,,,,,,,Shri Dinesh Mills Ltd,,,,,,
142,,,,,,,,,,,,,,,,,,,,,,,,,,,,,,,,,,,,,,,,,,,,,,,,SBFC Finance Ltd,,,,,,,,,,,,,,Systango Technologies Ltd,,,,,,,,,,,,,,,,,,,,,,,,,,,,,,,,,,,,,,,,,,,,,,Shree Rajasthan Syntex Ltd,,,,,,
143,,,,,,,,,,,,,,,,,,,,,,,,,,,,,,,,,,,,,,,,,,,,,,,,SBI Cards & Payment Services Ltd,,,,,,,,,,,,,,TAC Infosec Ltd,,,,,,,,,,,,,,,,,,,,,,,,,,,,,,,,,,,,,,,,,,,,,,Shekhawati Industries Ltd,,,,,,
144,,,,,,,,,,,,,,,,,,,,,,,,,,,,,,,,,,,,,,,,,,,,,,,,Shardul Securities Ltd,,,,,,,,,,,,,,Tanla Platforms Ltd,,,,,,,,,,,,,,,,,,,,,,,,,,,,,,,,,,,,,,,,,,,,,,Shiva Mills Ltd,,,,,,
145,,,,,,,,,,,,,,,,,,,,,,,,,,,,,,,,,,,,,,,,,,,,,,,,Share India Securities Ltd,,,,,,,,,,,,,,Tata Elxsi Ltd,,,,,,,,,,,,,,,,,,,,,,,,,,,,,,,,,,,,,,,,,,,,,,Shiva Texyarn Ltd,,,,,,
146,,,,,,,,,,,,,,,,,,,,,,,,,,,,,,,,,,,,,,,,,,,,,,,,Shriram City Union Finance Ltd(Merged),,,,,,,,,,,,,,Tata Technologies Ltd,,,,,,,,,,,,,,,,,,,,,,,,,,,,,,,,,,,,,,,,,,,,,,Shree Karni Fabcom Ltd,,,,,,
147,,,,,,,,,,,,,,,,,,,,,,,,,,,,,,,,,,,,,,,,,,,,,,,,Shriram Finance Ltd,,,,,,,,,,,,,,Tata Consultancy Services Ltd,,,,,,,,,,,,,,,,,,,,,,,,,,,,,,,,,,,,,,,,,,,,,,Shri Lakshmi Cotsyn Ltd,,,,,,
148,,,,,,,,,,,,,,,,,,,,,,,,,,,,,,,,,,,,,,,,,,,,,,,,SIL Investments Ltd,,,,,,,,,,,,,,Tech Mahindra Ltd,,,,,,,,,,,,,,,,,,,,,,,,,,,,,,,,,,,,,,,,,,,,,,Shri Techtex Ltd,,,,,,
149,,,,,,,,,,,,,,,,,,,,,,,,,,,,,,,,,,,,,,,,,,,,,,,,Silicon Valley Infotech Ltd,,,,,,,,,,,,,,Tera Software Ltd,,,,,,,,,,,,,,,,,,,,,,,,,,,,,,,,,,,,,,,,,,,,,,Signoria Creation Ltd,,,,,,
150,,,,,,,,,,,,,,,,,,,,,,,,,,,,,,,,,,,,,,,,,,,,,,,,Smartlink Holdings Ltd,,,,,,,,,,,,,,Tracxn Technologies Ltd,,,,,,,,,,,,,,,,,,,,,,,,,,,,,,,,,,,,,,,,,,,,,,Siyaram Silk Mills Ltd,,,,,,
151,,,,,,,,,,,,,,,,,,,,,,,,,,,,,,,,,,,,,,,,,,,,,,,,Som Datt Finance Corporation Ltd,,,,,,,,,,,,,,Trejhara Solutions Ltd,,,,,,,,,,,,,,,,,,,,,,,,,,,,,,,,,,,,,,,,,,,,,,SKS Textiles Ltd,,,,,,
152,,,,,,,,,,,,,,,,,,,,,,,,,,,,,,,,,,,,,,,,,,,,,,,,Spandana Sphoorty Financial Ltd,,,,,,,,,,,,,,Trident Techlabs Ltd,,,,,,,,,,,,,,,,,,,,,,,,,,,,,,,,,,,,,,,,,,,,,,Sportking India Ltd,,,,,,
153,,,,,,,,,,,,,,,,,,,,,,,,,,,,,,,,,,,,,,,,,,,,,,,,SRG Housing Finance Ltd,,,,,,,,,,,,,,Tridhya Tech Ltd,,,,,,,,,,,,,,,,,,,,,,,,,,,,,,,,,,,,,,,,,,,,,,STL Global Ltd,,,,,,
154,,,,,,,,,,,,,,,,,,,,,,,,,,,,,,,,,,,,,,,,,,,,,,,,Starteck Finance Ltd,,,,,,,,,,,,,,Trigyn Technologies Ltd,,,,,,,,,,,,,,,,,,,,,,,,,,,,,,,,,,,,,,,,,,,,,,Suditi Industries Ltd,,,,,,
155,,,,,,,,,,,,,,,,,,,,,,,,,,,,,,,,,,,,,,,,,,,,,,,,STEL Holdings Ltd,,,,,,,,,,,,,,Trust Fintech Ltd,,,,,,,,,,,,,,,,,,,,,,,,,,,,,,,,,,,,,,,,,,,,,,Sumeet Industries Ltd,,,,,,
156,,,,,,,,,,,,,,,,,,,,,,,,,,,,,,,,,,,,,,,,,,,,,,,,Summit Securities Ltd,,,,,,,,,,,,,,Unicommerce eSolutions Ltd,,,,,,,,,,,,,,,,,,,,,,,,,,,,,,,,,,,,,,,,,,,,,,Super Sales India Ltd,,,,,,
157,,,,,,,,,,,,,,,,,,,,,,,,,,,,,,,,,,,,,,,,,,,,,,,,Sundaram Finance Holdings Ltd,,,,,,,,,,,,,,Vakrangee Ltd,,,,,,,,,,,,,,,,,,,,,,,,,,,,,,,,,,,,,,,,,,,,,,Supreme (India) Impex Ltd,,,,,,
158,,,,,,,,,,,,,,,,,,,,,,,,,,,,,,,,,,,,,,,,,,,,,,,,Sundaram Finance Ltd,,,,,,,,,,,,,,Varanium Cloud Ltd Partly Paidup,,,,,,,,,,,,,,,,,,,,,,,,,,,,,,,,,,,,,,,,,,,,,,Suryalakshmi Cotton Mills Ltd,,,,,,
159,,,,,,,,,,,,,,,,,,,,,,,,,,,,,,,,,,,,,,,,,,,,,,,,Tata Investment Corporation Ltd,,,,,,,,,,,,,,Varanium Cloud Ltd,,,,,,,,,,,,,,,,,,,,,,,,,,,,,,,,,,,,,,,,,,,,,,Suryavanshi Spinning Mills Ltd,,,,,,
160,,,,,,,,,,,,,,,,,,,,,,,,,,,,,,,,,,,,,,,,,,,,,,,,TCI Finance Ltd,,,,,,,,,,,,,,Vertexplus Technologies Ltd,,,,,,,,,,,,,,,,,,,,,,,,,,,,,,,,,,,,,,,,,,,,,,Sutlej Textiles and Industries Ltd,,,,,,
161,,,,,,,,,,,,,,,,,,,,,,,,,,,,,,,,,,,,,,,,,,,,,,,,Teamo Productions HQ Ltd,,,,,,,,,,,,,,Vertoz Ltd,,,,,,,,,,,,,,,,,,,,,,,,,,,,,,,,,,,,,,,,,,,,,,SVP Global Textiles Ltd,,,,,,
162,,,,,,,,,,,,,,,,,,,,,,,,,,,,,,,,,,,,,,,,,,,,,,,,The Investment Trust of India Ltd,,,,,,,,,,,,,,Virinchi Ltd,,,,,,,,,,,,,,,,,,,,,,,,,,,,,,,,,,,,,,,,,,,,,,Swaraj Suiting Ltd,,,,,,
163,,,,,,,,,,,,,,,,,,,,,,,,,,,,,,,,,,,,,,,,,,,,,,,,Times Guaranty Ltd,,,,,,,,,,,,,,Visesh Infotecnics Ltd,,,,,,,,,,,,,,,,,,,,,,,,,,,,,,,,,,,,,,,,,,,,,,T T Ltd,,,,,,
164,,,,,,,,,,,,,,,,,,,,,,,,,,,,,,,,,,,,,,,,,,,,,,,,Tourism Finance Corporation of India Ltd,,,,,,,,,,,,,,Vivo Collaboration Solutions Ltd,,,,,,,,,,,,,,,,,,,,,,,,,,,,,,,,,,,,,,,,,,,,,,Trident Ltd,,,,,,
165,,,,,,,,,,,,,,,,,,,,,,,,,,,,,,,,,,,,,,,,,,,,,,,,Transwarranty Finance Ltd Partly Paidup,,,,,,,,,,,,,,VL E-Governance & IT Solutions Ltd,,,,,,,,,,,,,,,,,,,,,,,,,,,,,,,,,,,,,,,,,,,,,,United Polyfab Gujarat Ltd,,,,,,
166,,,,,,,,,,,,,,,,,,,,,,,,,,,,,,,,,,,,,,,,,,,,,,,,Transwarranty Finance Ltd,,,,,,,,,,,,,,We Win Ltd,,,,,,,,,,,,,,,,,,,,,,,,,,,,,,,,,,,,,,,,,,,,,,Uniworth Ltd,,,,,,
167,,,,,,,,,,,,,,,,,,,,,,,,,,,,,,,,,,,,,,,,,,,,,,,,TruCap Finance Ltd,,,,,,,,,,,,,,Wipro Ltd,,,,,,,,,,,,,,,,,,,,,,,,,,,,,,,,,,,,,,,,,,,,,,Vardhman Acrylics Ltd,,,,,,
168,,,,,,,,,,,,,,,,,,,,,,,,,,,,,,,,,,,,,,,,,,,,,,,,TVS Holdings Ltd,,,,,,,,,,,,,,Xchanging Solutions Ltd,,,,,,,,,,,,,,,,,,,,,,,,,,,,,,,,,,,,,,,,,,,,,,Vardhman Polytex Ltd,,,,,,
169,,,,,,,,,,,,,,,,,,,,,,,,,,,,,,,,,,,,,,,,,,,,,,,,U. Y. Fincorp Ltd,,,,,,,,,,,,,,Xelpmoc Design and Tech Ltd,,,,,,,,,,,,,,,,,,,,,,,,,,,,,,,,,,,,,,,,,,,,,,Vardhman Textiles Ltd,,,,,,
170,,,,,,,,,,,,,,,,,,,,,,,,,,,,,,,,,,,,,,,,,,,,,,,,Ugro Capital Ltd,,,,,,,,,,,,,,XT Global Infotech Ltd,,,,,,,,,,,,,,,,,,,,,,,,,,,,,,,,,,,,,,,,,,,,,,Vaxtex Cotfab Ltd,,,,,,
171,,,,,,,,,,,,,,,,,,,,,,,,,,,,,,,,,,,,,,,,,,,,,,,,Usha Financial Services Ltd,,,,,,,,,,,,,,Yudiz Solutions Ltd,,,,,,,,,,,,,,,,,,,,,,,,,,,,,,,,,,,,,,,,,,,,,,Vera Synthetic Ltd,,,,,,
172,,,,,,,,,,,,,,,,,,,,,,,,,,,,,,,,,,,,,,,,,,,,,,,,UTI Asset Management Company Ltd,,,,,,,,,,,,,,Zaggle Prepaid Ocean Services Ltd,,,,,,,,,,,,,,,,,,,,,,,,,,,,,,,,,,,,,,,,,,,,,,Vinny Overseas Ltd,,,,,,
173,,,,,,,,,,,,,,,,,,,,,,,,,,,,,,,,,,,,,,,,,,,,,,,,V B Desai Financial Services Ltd,,,,,,,,,,,,,,Zensar Technologies Ltd,,,,,,,,,,,,,,,,,,,,,,,,,,,,,,,,,,,,,,,,,,,,,,VIP Clothing Ltd,,,,,,
174,,,,,,,,,,,,,,,,,,,,,,,,,,,,,,,,,,,,,,,,,,,,,,,,Vardhman Holdings Ltd,,,,,,,,,,,,,,,,,,,,,,,,,,,,,,,,,,,,,,,,,,,,,,,,,,,,,,,,,,,,Vishal Fabrics Ltd,,,,,,
175,,,,,,,,,,,,,,,,,,,,,,,,,,,,,,,,,,,,,,,,,,,,,,,,Viji Finance Ltd,,,,,,,,,,,,,,,,,,,,,,,,,,,,,,,,,,,,,,,,,,,,,,,,,,,,,,,,,,,,Voith Paper Fabrics India Ltd,,,,,,
176,,,,,,,,,,,,,,,,,,,,,,,,,,,,,,,,,,,,,,,,,,,,,,,,VLS Finance Ltd,,,,,,,,,,,,,,,,,,,,,,,,,,,,,,,,,,,,,,,,,,,,,,,,,,,,,,,,,,,,VTM Ltd,,,,,,
177,,,,,,,,,,,,,,,,,,,,,,,,,,,,,,,,,,,,,,,,,,,,,,,,Welspun Investments & Commercials Ltd,,,,,,,,,,,,,,,,,,,,,,,,,,,,,,,,,,,,,,,,,,,,,,,,,,,,,,,,,,,,Weizmann Ltd,,,,,,
178,,,,,,,,,,,,,,,,,,,,,,,,,,,,,,,,,,,,,,,,,,,,,,,,Williamson Magor & Company Ltd,,,,,,,,,,,,,,,,,,,,,,,,,,,,,,,,,,,,,,,,,,,,,,,,,,,,,,,,,,,,Welspun Living Ltd,,,,,,
179,,,,,,,,,,,,,,,,,,,,,,,,,,,,,,,,,,,,,,,,,,,,,,,,,,,,,,,,,,,,,,,,,,,,,,,,,,,,,,,,,,,,,,,,,,,,,,,,,,,,,,,,,,,,Winsome Yarns Ltd,,,,,,
