33,,,,,,,,Jullundur Motor Agency (Delhi) Ltd,,,State Bank of India,,,Britannia Industries Ltd,,Lakshmi Electrical Control Systems Ltd,John Cockerill India Ltd,,Sterling Tools Ltd,,,,Deepak Fertilizers & Petrochemicals Corp Ltd,,,RPP Infra Projects Ltd Partly Paidup,MIRC Electronics Ltd,,,,,,,,,,,,,,,Thejo Engineering Ltd,Pritish Nandy Communications Ltd,,Gujarat Ambuja Exports Ltd,,,Centrum Capital Ltd,,,AVT Natural Products Ltd,,,,,,Suraksha Diagnostic Ltd,,TajGVK Hotels & Resorts Ltd,,,Canarys Automations Ltd,GPT Infraprojects Ltd,,,,Premier Roadlines Ltd,,,,IMEC Services Ltd,Tata Investment Corporation Ltd,,,Life Insurance Corporation of India,Rishi Techtex Ltd,,,,Divis Laboratories Ltd,,Rex Pipes & Cables Industries Ltd,,,,,,,,,ICDS Ltd,,,,Osia Hyper Retail Ltd,,,,,,,JSW Ispat Special Products Ltd(Merged),,Vishwaraj Sugar Industries Ltd,,,,Digjam Ltd,,Honasa Consumer Ltd,,,,
34,,,,,,,,Kinetic Engineering Ltd,,,Suryoday Small Finance Bank Ltd,,,Bharat Petroleum Corporation Ltd,,Maks Energy Solutions India Ltd,Jupiter Wagons Ltd,,Sundaram Clayton Ltd,,,,Deepak Nitrite Ltd,,,Setubandhan Infrastructure Ltd,Monica Electronics Ltd,,,,,,,,,,,,,,,Transwind Infrastructures Ltd,PVR Inox Ltd,,Hatsun Agro Product Ltd,,,Choice International Ltd,,,Sarveshwar Foods Ltd,,,,,,Suven Life Sciences Ltd,,TGB Banquets & Hotels Ltd,,,Cigniti Technologies Ltd,GVK Power & Infrastructure Ltd,,,,Rajasthan Petro Synthetics Ltd,,,,Indiabulls Enterprises Ltd,TCI Finance Ltd,,,Engineers India Ltd,Rollatainers Ltd,,,,Dr Reddys Laboratories Ltd,,Royal Cushion Vinyl Products Ltd,,,,,,,,,KBC Global Ltd,,,,Popees Care Ltd,,,,,,,JSW Steel Ltd,,Willard India Ltd,,,,Divyadhan Recycling Industries Ltd,,Integra Essentia Ltd,,,,
35,,,,,,,,Kross Ltd,,,Tamilnad Mercantile Bank Ltd,,,Cipla Ltd,,Marine Electricals (India) Ltd,Jyoti CNC Automation Ltd,,Synergy Green Industries Ltd,,,,Diamines & Chemicals Ltd,,,SKIL Infrastructure Ltd,Naman In-Store (India) Ltd,,,,,,,,,,,,,,,Uniparts India Ltd,Radaan Mediaworks (I) Ltd,,Heritage Foods Ltd,,,Cholamandalam Financial Holdings Ltd,,,Foods & Inns Ltd,,,,,,Syngene International Ltd,,The Byke Hospitality Ltd,,,Coforge Ltd,H.G. Infra Engineering Ltd,,,,Reliance Industrial Infrastructure Ltd,,,,Infollion Research Services Ltd,The Investment Trust of India Ltd,,,Hindustan Aeronautics Ltd,Sabar Flex India Ltd,,,,Dynachem Pharmaceuticals (Export) Ltd,,Safari Industries (India) Ltd,,,,,,,,,Keystone Realtors Ltd,,,,Popular Vehicles & Services Ltd,,,,,,,JTL Industries Ltd,,Zuari Industries Ltd,,,,Donear Industries Ltd,,Jubilant Agri & Consumer Products Ltd,,,,
36,,,,,,,,L G Balakrishnan & Bros Ltd,,,UCO Bank,,,Dr. Reddy's Laboratories Ltd,,Modern Insulators Ltd,Kabra Extrusion Technik Ltd,,Tayo Rolls Ltd,,,,DIC India Ltd,,,Supreme Holdings & Hospitality Ltd,Omfurn India Ltd,,,,,,,,,,,,,,,United Heat Transfer Ltd,Radiowalla Network Ltd,,Hindustan Unilever Ltd,,,Cholamandalam Investment & Finance Company Ltd,,,Apex Frozen Foods Ltd,,,,,,Take Solutions Ltd,,Univa Foods Ltd,,,Cranes Software International Ltd,HEC Infra Projects Ltd,,,,Ritco Logistics Ltd,,,,Inox Green Energy Services Ltd,Ugro Capital Ltd,,,NMDC Ltd,Sah Polymers Ltd,,,,Emcure Pharmaceuticals Ltd,,Sanco Industries Ltd,,,,,,,,,Kolte Patil Developers Ltd,,,,Praxis Home Retail Ltd,,,,,,,Kalana Ispat Ltd,,,,,,E-Land Apparel Ltd,,Kalyani Commercials Ltd,,,,
37,,,,,,,,Lumax Auto Technologies Ltd,,,Ujjivan Small Finance Bank Ltd,,,Shriram Finance Ltd,,Modern Malleables Ltd,Kilburn Engineering Ltd,,Tirupati Forge Ltd,,,,DMCC Speciality Chemicals Ltd,,,Unity Infraprojects Ltd,Opal Luxury Time Products Ltd,,,,,,,,,,,,,,,,Raj Television Network Ltd,,Hindustan Foods Ltd,,,Consolidated Finvest & Holdings Ltd,,,KN Agri Resources Ltd,,,,,,Tarsons Products Ltd,,Ventive Hospitality Ltd,,,Cura Technologies Ltd,Hindustan Construction Company Ltd,,,,S J Logistics (India) Ltd,,,,Integrated Personnel Services Ltd,Vardhman Holdings Ltd,,,Power Finance Corporation Ltd,Sati Poly Plast Ltd,,,,ERIS Lifesciences Ltd,,Shaily Engineering Plastics Ltd,,,,,,,,,Lancor Holdings Ltd,,,,Purple United Sales Ltd,,,,,,,Kalyani Steels Ltd,,,,,,Eastern Silk Industries Ltd,,Kamdhenu Ventures Ltd,,,,
38,,,,,,,,Lumax Industries Ltd,,,Union Bank of India,,,Tata Consumer Products Ltd,,Modison Ltd,Kirloskar Brothers Ltd,,,,,,Ducol Organics & Colours Ltd,,,V R Infraspace Ltd,Orient Electric Ltd,,,,,,,,,,,,,,,,Saregama India Ltd,,HMA Agro Industries Ltd,,,Coral India Finance & Housing Ltd,,,SKM Egg Products Export (India) Ltd,,,,,,Thyrocare Technologies Ltd,,Viceroy Hotels Ltd,,,Cyber Media Research & Services Ltd,IL&FS Engineering & Construction Co Ltd,,,,Shree Vasu Logistics Ltd,,,,International Gemmological Institute (India) Ltd,Williamson Magor & Company Ltd,,,SJVN Ltd,Shree Rama Multi-Tech Ltd,,,,FDC Ltd,,Sintex Plastics Technology Ltd,,,,,,,,,Landmark Property Development Company Ltd,,,,Radha Madhav Corporation Ltd,,,,,,,Kamdhenu Ltd,,,,,,Eskay KnIT (India) Ltd,,Kandagiri Spinning Mills Ltd,,,,
39,,,,,,,,Mandeep Auto Industries Ltd,,,Utkarsh Small Finance Bank Ltd,,,Hero MotoCorp Ltd,,Neueon Towers Ltd,Kirloskar Pneumatic Company Ltd,,,,,,Dynemic Products Ltd Partly Paidup,,,Valecha Engineering Ltd,OSEL Devices Ltd,,,,,,,,,,,,,,,,Shemaroo Entertainment Ltd,,Hoac Foods India Ltd,,,Cox & Kings Financial Service Ltd,,,Krishival Foods Ltd,,,,,,Unihealth Hospitals Ltd,,,,,Cybertech Systems & Software Ltd,IL&FS Transportation Networks Ltd,,,,Sical Logistics Ltd,,,,International Travel House Ltd,,,,Housing and Urban Development Corporation Ltd,Shetron Ltd,,,,Gland Pharma Ltd,,S J S Enterprises Ltd,,,,,,,,,Laxmi Goldorna House Ltd,,,,Redtape Ltd,,,,,,,Kataria Industries Ltd,,,,,,Faze Three Ltd,,Kanel Industries Ltd,,,,
40,,,,,,,,Maxvolt Energy Industries Ltd,,,Yes Bank Ltd,,,IndusInd Bank Ltd,,Power & Instrumentation (Gujarat) Ltd,Kirloskar Oil Engines Ltd,,,,,,Dynemic Products Ltd,,,Vascon Engineers Ltd,Pacific Industries Ltd,,,,,,,,,,,,,,,,Silly Monks Entertainment Ltd,,Indo French Biotech Enterprises Ltd,,,CreditAccess Grameen Ltd,,,IFB Agro Industries Ltd,,,,,,Vaidya Sane Ayurved Laboratories Ltd,,,,,Cyient Ltd,Indian Hume Pipe Company Ltd,,,,Sindhu Trade Links Ltd,,,,Invigorated Business Consulting Ltd,,,,The New India Assurance Company Ltd,Shree Tirupati Balajee FIBC Ltd,,,,Glaxosmithkline Pharmaceuticals Ltd,,SMVD Poly Pack Ltd,,,,,,,,,Macrotech Developers Ltd,,,,Sai Silks (Kalamandir) Ltd,,,,,,,Kirloskar Ferrous Industries Ltd,,,,,,Fiberweb (India) Ltd,,Khaitan (India) Ltd,,,,
41,,,,,,,,Menon Bearings Ltd,,,,,,,,Premier Energies Ltd,KSB Ltd,,,,,,Elantas Beck India Ltd,,,,Parin Enterprises Ltd,,,,,,,,,,,,,,,,Siti Networks Ltd,,Indo US Bio-Tech Ltd,,,Crest Ventures Ltd,,,Euro India Fresh Foods Ltd,,,,,,Vijaya Diagnostic Centre Ltd,,,,,Datamatics Global Services Ltd,Ion Exchange (India) Ltd,,,,Snowman Logistics Ltd,,,,JITF Infra Logistics Ltd,,,,GAIL (India) Ltd,Shree Tirupati Balajee Agro Trading Co. Ltd,,,,Glenmark Pharmaceuticals Ltd,,Solve Plastic Products Ltd,,,,,,,,,Majestic Auto Ltd,,,,Salora International Ltd,,,,,,,Krishca Strapping Solutions Ltd,,,,,,Filatex Fashions Ltd,,Kothari Industrial Corporation Ltd,,,,
42,,,,,,,,Minda Corporation Ltd,,,,,,,,Quality Power Electrical Equipments Ltd,Latteys Industries Ltd,,,,,,Epigral Ltd,,,,Permanent Magnets Ltd,,,,,,,,,,,,,,,,Sri Adhikari Brothers Television Network Ltd,,Italian Edibles Ltd,,,CSL Finance Ltd,,,Megastar Foods Ltd,,,,,,Vimta Labs Ltd,,,,,Delaplex Ltd,IRB Infrastructure Developers Ltd,,,,TCI Express Ltd,,,,Jiya Eco-Products Ltd,,,,KIOCL Ltd,SPP Polymer Ltd,,,,Granules India Ltd,,Supreme Industries Ltd,,,,,,,,,Marathon Nextgen Realty Ltd,,,,Shankara Building Products Ltd,,,,,,,Kritika Wires Ltd,,,,,,Filatex India Ltd,,Kothari Products Ltd,,,,
43,,,,,,,,Motherson Sumi Wiring India Ltd,,,,,,,,Ravindra Energy Ltd,Lloyds Engineering Works Ltd,,,,,,Fairchem Organics Ltd,,,,PG Electroplast Ltd,,,,,,,,,,,,,,,,SRS Ltd,,Jeyyam Global Foods Ltd,,,Dam Capital Advisors Ltd,,,Nakoda Group Of Industries Ltd,,,,,,Yatharth Hospital & Trauma Care Services Ltd,,,,,Dev Information Technology Ltd,Ircon International Ltd,,,,Tejas Cargo India Ltd,,,,Kapston Services Ltd,,,,NHPC Ltd,Srivasavi Adhesive Tapes Ltd,,,,Gufic BioSciences Ltd,,Texmo Pipes & Products Ltd,,,,,,,,,Mason Infratech Ltd,,,,Shoppers Stop Ltd,,,,,,,Maharashtra Seamless Ltd,,,,,,Futura Polyesters Ltd,,Kridhan Infra Ltd,,,,
44,,,,,,,,Munjal Auto Industries Ltd,,,,,,,,Rishabh Instruments Ltd,Lokesh Machines Ltd,,,,,,Fine Organic Industries Ltd,,,,Pokarna Ltd,,,,,,,,,,,,,,,,Sun TV Network Ltd,,JHS Svendgaard Laboratories Ltd,,,DCM Financial Services Ltd,,,Hindustan Unilever Ltd,,,,,,,,,,,Diensten Tech Ltd,ISGEC Heavy Engineering  Ltd,,,,Timescan Logistics (India) Ltd,,,,Kesar Terminals & Infrastructure Ltd,,,,Container Corporation of India Ltd,TCPL Packaging Ltd,,,,Gujarat Themis Biosyn Ltd,,Tijaria Polypipes Ltd,,,,,,,,,Max Estates Ltd,,,,Spencers Retail Ltd,,,,,,,Mahamaya Steel Industries Ltd,,,,,,Gajanand International Ltd,,Le Merite Exports Ltd,,,,
45,,,,,,,,Munjal Showa Ltd,,,,,,,,S & S Power Switchgear Ltd,Manugraph India Ltd,,,,,,Fineotex Chemical Ltd,,,,Priti International Ltd,,,,,,,,,,,,,,,,Thinking Hats Entertainment Solutions Ltd,,Jyothy Labs Ltd,,,Delphi World Money Ltd,,,Sarveshwar Foods Ltd,,,,,,,,,,,DigiSpice Technologies Ltd,ITD Cementation India Ltd,,,,Total Transport Systems Ltd,,,,Kesoram Industries Ltd,,,,Indian Railway Finance Corporation Ltd,TPI India Ltd,,,,Hester Biosciences Ltd,,Time Technoplast Ltd,,,,,,,,,Medi Caps Ltd,,,,Trent Ltd,,,,,,,Man Industries (India) Ltd,,,,,,Ganesha Ecosphere Ltd,,Lloyds Enterprises Ltd,,,,
46,,,,,,,,NDR Auto Components Ltd,,,,,,,,Saakshi Medtech & Panels Ltd,Mazda Ltd,,,,,,Foseco India Ltd,,,,Prizor Viztech Ltd,,,,,,,,,,,,,,,,Tips Films Ltd,,Karuturi Global Ltd,,,Dhani Services Ltd Partly Paid Up,,,Gopal Snacks Ltd,,,,,,,,,,,Dion Global Solutions Ltd,IVRCL Ltd,,,,TransIndia Real Estate Ltd,,,,KHFM Hospitality & Facility Mgt. Services Ltd,,,,Mazagon Dock Shipbuilders Ltd,TPL Plastech Ltd,,,,Hikal Ltd,,Tokyo Plast International Ltd,,,,,,,,,Modipon Ltd,,,,V2 Retail Ltd,,,,,,,Manaksia Coated Metals & Industries Ltd,,,,,,Gangotri Textiles Ltd,,Lypsa Gems & Jewellery Ltd,,,,
47,,,,,,,,OBSC Perfection Ltd,,,,,,,,Sahaj Solar Ltd,Nitin Fire Protection Industries Ltd,,,,,,Futuristic Offshore Services and Chemical Ltd,,,,Rexpro Enterprises Ltd,,,,,,,,,,,,,,,,Tips Music Ltd,,Kaveri Seed Company Ltd,,,Dhani Services Ltd,,,Annapurna Swadisht Ltd,,,,,,,,,,,DRC Systems India Ltd,J Kumar Infraprojects Ltd,,,,Transport Corporation of India Ltd,,,,Kontor Space Ltd,,,,NBCC (India) Ltd,Trans Freight Containers Ltd,,,,Indoco Remedies Ltd,,Tulsi Extrusions Ltd,,,,,,,,,Motor & General Finance Ltd,,,,Vintage Coffee & Beverages Ltd,,,,,,,Manaksia Steels Ltd,,,,,,Garware Technical Fibres Ltd,,Maheshwari Logistics Ltd,,,,
48,,,,,,,,Omax Autos Ltd,,,,,,,,Salzer Electronics Ltd,Panasonic Carbon India Company Ltd,,,,,,Gujarat Narmada Valley Fertilizers & Chemicals Ltd,,,,Sharp India Ltd,,,,,,,,,,,,,,,,Touchwood Entertainment Ltd,,KCK Industries Ltd,,,Dhunseri Investments Ltd,,,Mukka Proteins Ltd,,,,,,,,,,,Dynacons Systems & Solutions Ltd,K E C International Ltd,,,,TVS Supply Chain Solutions Ltd,,,,Kotyark Industries Ltd,,,,Mishra Dhatu Nigam Ltd,Uflex Ltd,,,,Ind-Swift Ltd,,V I P Industries Ltd,,,,,,,,,NESCO Ltd,,,,V-Mart Retail Ltd,,,,,,,Mangalam Alloys Ltd,,,,,,GB Global Ltd,,Manaksia Ltd,,,,
49,,,,,,,,PAE Ltd,,,,,,,,Schneider Electric Infrastructure Ltd,Perfect Infraengineers Ltd,,,,,,Galaxy Surfactants Ltd,,,,Sheela Foam Ltd,,,,,,,,,,,,,,,,TV Vision Ltd,,Kohinoor Foods Ltd,,,Dolat Algotech Ltd,,,Goyal Salt Ltd,,,,,,,,,,,E2E Networks Ltd,K.P. Energy Ltd,,,,VRL Logistics Ltd,,,,Krystal Integrated Services Ltd,,,,Bharat Dynamics Ltd,Uma Converter Ltd,,,,Ind-Swift Laboratories Ltd,,Vikas Ecotech Ltd Partly Paidup,,,,,,,,,Nila Spaces Ltd,,,,Warren Tea Ltd,,,,,,,Mangalam Worldwide Ltd,,,,,,Gem Spinners India Ltd,,Mangalam Global Enterprise Ltd,,,,
50,,,,,,,,Pavna Industries Ltd,,,,,,,,Servotech Renewable Power System Ltd,Pitti Engineering Ltd,,,,,,GHCL Ltd,,,,Sonam Ltd,,,,,,,,,,,,,,,,Vels Film International Ltd,,Kore Foods Ltd,,,Edelweiss Financial Services Ltd,,,Sheetal Cool Products Ltd,,,,,,,,,,,eClerx Services Ltd,K2 Infragen Ltd,,,,Western Carriers (India) Ltd,,,,Lamosaic India Ltd,,,,REC Ltd,Worth Peripherals Ltd,,,,Infinium Pharmachem Ltd,,Wim Plast Ltd,,,,,,,,,Oberoi Realty Ltd,,,,,,,,,,,Mideast Integrated Steels Ltd,,,,,,GHCL Textiles Ltd,,Metroglobal Ltd,,,,
51,,,,,,,,PPAP Automotive Ltd,,,,,,,,Shivalic Power Control Ltd,Praj Industries Ltd,,,,,,GOCL Corporation Ltd,,,,Stanley Lifestyles Ltd,,,,,,,,,,,,,,,,Winpro Industries Ltd,,Kovilpatti Lakshmi Roller Flour Mills Ltd,,,Equitas Holdings Ltd,,,Srivari Spices and Foods Ltd,,,,,,,,,,,Ed & Tech International Ltd,Kalpataru Projects International Ltd,,,,Zeal Global Services Ltd,,,,Lloyds Luxuries Ltd,,,,Indian Railway Catering & Tourism Corporation Ltd,XPRO India Ltd,,,,Innova Captab Ltd,,,,,,,,,,,Omaxe Ltd,,,,,,,,,,,MSP Steel & Power Ltd,,,,,,Ginni Filaments Ltd,,Mid India Industries Ltd,,,,
52,,,,,,,,Precision Camshafts Ltd,,,,,,,,Shri Ram Switchgears Ltd,Premier Ltd,,,,,,Godrej Industries Ltd,,,,Stove Kraft Ltd,,,,,,,,,,,,,,,,Wonderla Holidays Ltd,,KRBL Ltd,,,Fedbank Financial Services Ltd,,,Kohinoor Foods Ltd,,,,,,,,,,,eMudhra Ltd,Kay Cee Energy & Infra Ltd,,,,Zinka Logistics Solutions Ltd,,,,Madhusudan Industries Ltd,,,,Rites Ltd,,,,,IOL Chemicals & Pharmaceuticals Ltd,,,,,,,,,,,Peninsula Land Ltd,,,,,,,,,,,Mukand Ltd,,,,,,Globale Tessile Ltd,,Mittal Life Style Ltd,,,,
53,,,,,,,,Precision Metaliks Ltd,,,,,,,,Siemens Ltd,Rappid Valves India Ltd,,,,,,GP Petroleums Ltd,,,,Symphony Ltd,,,,,,,,,,,,,,,,Zee Entertainment Enterprises Ltd,,Krishival Foods Ltd,,,Five-Star Business Finance Ltd,,,Baba Food Processing (India) Ltd,,,,,,,,,,,Enfuse Solutions Ltd,KNR Constructions Ltd,,,,,,,,Manglam Infra & Engineering Ltd,,,,Rail Vikas Nigam Ltd,,,,,Ipca Laboratories Ltd,,,,,,,,,,,Phoenix International Ltd,,,,,,,,,,,Mukat Pipes Ltd,,,,,,Globe Textiles (India) Ltd,,MMTC Ltd,,,,
54,,,,,,,,Premium Plast Ltd,,,,,,,,Solex Energy Ltd,Roto Pumps Ltd,,,,,,Grauer & Weil (India) Ltd,,,,Timex Group India Ltd,,,,,,,,,,,,,,,,Z-Tech (India) Ltd,,KSE Ltd,,,Fusion Finance Ltd,,,HOAC Foods India Ltd,,,,,,,,,,,Enser Communications Ltd,Konstelec Engineers Ltd,,,,,,,,Matrimony.com Ltd,,,,Gujarat Gas Ltd,,,,,J B Chemicals & Pharmaceuticals Ltd,,,,,,,,,,,Phoenix Mills Ltd,,,,,,,,,,,Newmalayalam Steel Ltd,,,,,,Gloster Ltd,,Moksh Ornaments Ltd,,,,
55,,,,,,,,Pricol Ltd,,,,,,,,Spectrum Electrical Industries Ltd,Royal Arc Electrodes Ltd,,,,,,Gujarat Alkalies & Chemicals Ltd,,,,Transteel Seating Technologies Ltd,,,,,,,,,,,,,,,,,,L T Foods Ltd,,,GACM Technologies Ltd-DVR,,,,,,,,,,,,,,Equippp Social Impact Technologies Ltd,Lakshya Powertech Ltd,,,,,,,,MITCON Consultancy & Engg. Serv. Ltd Partly Paidup,,,,,,,,,J K Pharmachem Ltd,,,,,,,,,,,Poddar Housing & Development Ltd,,,,,,,,,,,NMDC Steel Ltd,,,,,,Go Fashion (India) Ltd,,Mysore Petro Chemicals Ltd,,,,
56,,,,,,,,Pritika Auto Industries Ltd,,,,,,,,Sungarner Energies Ltd,Shakti Pumps (India) Ltd,,,,,,Gujarat Fluorochemicals Ltd,,,,TTK Prestige Ltd,,,,,,,,,,,,,,,,,,Lakshmi Energy & Foods Ltd,,,Ganges Securities Ltd,,,,,,,,,,,,,,Expleo Solutions Ltd,Larsen & Toubro Ltd,,,,,,,,Mitcon Consultancy & Engineering Services Ltd,,,,,,,,,Jagsonpal Pharmaceuticals Ltd,,,,,,,,,,,Prajay Engineers Syndicate Ltd,,,,,,,,,,,Nova Iron & Steel Ltd,,,,,,Grasim Industries Ltd,,Neopolitan Pizza and Foods Ltd,,,,
57,,,,,,,,RACL Geartech Ltd,,,,,,,,Supreme Power Equipment Ltd,Shanthi Gears Ltd,,,,,,Gulf Oil Lubricants India Ltd,,,,Value Industries Ltd,,,,,,,,,,,,,,,,,,Libas Consumer Products Ltd,,,GFL Ltd,,,,,,,,,,,,,,FCS Software Solutions Ltd,Likhitha Infrastructure Ltd,,,,,,,,Modi Rubber Ltd,,,,,,,,,Jeena Sikho Lifecare Ltd,,,,,,,,,,,Prestige Estates Projects Ltd,,,,,,,,,,,Oil Country Tubular Ltd,,,,,,Grasim Industries Ltd- Partly Paidup,,Newjaisa Technologies Ltd,,,,
58,,,,,,,,Rane (Madras) Ltd,,,,,,,,Surana Solar Ltd,Standard Glass Lining Technology Ltd,,,,,,Heubach Colorants India Ltd,,,,Videocon Industries Ltd,,,,,,,,,,,,,,,,,,Madhur Industries Ltd,,,GIC Housing Finance Ltd,,,,,,,,,,,,,,Fidel Softech Ltd,Madhucon Projects Ltd,,,,,,,,MPIL Corporation Ltd,,,,,,,,,JFL Life Sciences Ltd,,,,,,,,,,,Puravankara Ltd,,,,,,,,,,,P S Raj Steels Ltd,,,,,,GSL Nova Petrochemicals Ltd,,Nitco Ltd,,,,
59,,,,,,,,Rane Brake Lining Ltd,,,,,,,,Suzlon Energy Ltd,Swaraj Engines Ltd,,,,,,Hi-Green Carbon Ltd,,,,Voltas Ltd,,,,,,,,,,,,,,,,,,Madhusudan Masala Ltd,,,GKW Ltd,,,,,,,,,,,,,,Firstsource Solutions Ltd,Manav Infra Projects Ltd,,,,,,,,Namo eWaste Management Ltd,,,,,,,,,Jubilant Pharmova Ltd,,,,,,,,,,,PVP Ventures Ltd,,,,,,,,,,,Panchmahal Steel Ltd,,,,,,GTN Industries Ltd,,Noesis Industries Ltd,,,,
60,,,,,,,,Rane Engine Valve Ltd,,,,,,,,Suzlon Energy Ltd Partly Paidup,Texmaco Rail & Engineering Ltd,,,,,,Himadri Speciality Chemical Ltd,,,,Whirlpool of India Ltd,,,,,,,,,,,,,,,,,,Manorama Industries Ltd,,,Gujarat Lease Financing Ltd,,,,,,,,,,,,,,GACM Technologies Ltd,MBL Infrastructure Ltd,,,,,,,,Nifty India Select 5 Corporate Groups,,,,,,,,,Kilitch Drugs (India) Ltd,,,,,,,,,,,Ravinder Heights Ltd,,,,,,,,,,,Pennar Industries Ltd,,,,,,GTN Textiles Ltd,,Nupur Recyclers Ltd,,,,
61,,,,,,,,Remsons Industries Ltd,,,,,,,,Swelect Energy Systems Ltd,Thermax Ltd,,,,,,Hindustan Organic Chemicals Ltd,,,,Wonder Electricals Ltd,,,,,,,,,,,,,,,,,,Manpasand Beverages Ltd,,,Gujarat State Financial Corporation,,,,,,,,,,,,,,Genesys International Corporation Ltd,McNally Bharat Engineering Company Ltd,,,,,,,,Nifty EV & New Age Automotive,,,,,,,,,Kopran Ltd,,,,,,,,,,,Raymond Ltd,,,,,,,,,,,Prakash Industries Ltd,,,,,,Gujarat Raffia Industries Ltd,,Optiemus Infracom Ltd,,,,
62,,,,,,,,Rico Auto Industries Ltd,,,,,,,,Transformers & Rectifiers India Ltd,TIL Ltd,,,,,,Hindcon Chemicals Ltd,,,,Zicom Electronic Security Systems Ltd,,,,,,,,,,,,,,,,,,Megastar Foods Ltd,,,Housing & Urban Development Corporation Ltd,,,,,,,,,,,,,,Globesecure Technologies Ltd,MEP Infrastructure Developers Ltd,,,,,,,,Nifty IPO,,,,,,,,,Krebs Biochemicals & Industries Ltd,,,,,,,,,,,Sam Industries Ltd,,,,,,,,,,,Prakash Steelage Ltd,,,,,,Himatsingka Seide Ltd,,Oriental Trimex Ltd,,,,
63,,,,,,,,Rushabh Precision Bearings Ltd,,,,,,,,Tarapur Transformers Ltd,Titagarh Rail Systems Ltd,,,,,,Hindprakash Industries Ltd,,,,,,,,,,,,,,,,,,,,,,Mrs Bectors Food Specialities Ltd,,,HB Stockholdings Ltd,,,,,,,,,,,,,,GSS Infotech Ltd,Mold-Tek Technologies Ltd,,,,,,,,Nifty500 Multicap Momentum Quality 50,,,,,,,,,Lasa Supergenerics Ltd,,,,,,,,,,,Sanathnagar Enterprises Ltd,,,,,,,,,,,Quality Foils (India) Ltd,,,,,,Indian Acrylics Ltd,,Oswal Agro Mills Ltd,,,,
64,,,,,,,,Samvardhana Motherson International Ltd,,,,,,,,TD Power Systems Ltd,TMT (I) Ltd,,,,,,HP Adhesives Ltd,,,,,,,,,,,,,,,,,,,,,,Mukka Proteins Ltd,,,HDFC Asset Management Company Ltd,,,,,,,,,,,,,,GVP Infotech Ltd,Navkar Urbanstructure Ltd,,,,,,,,Nifty India New Age Consumption,,,,,,,,,Laurus Labs Ltd,,,,,,,,,,,Satchmo Holdings Ltd,,,,,,,,,,,Rajratan Global Wire Ltd,,,,,,Indian Card Clothing Company Ltd,,Palred Technologies Ltd,,,,
65,,,,,,,,Sandhar Technologies Limited,,,,,,,,Triveni Turbine Ltd,TRF Ltd,,,,,,I G Petrochemicals Ltd,,,,,,,,,,,,,,,,,,,,,,Nakoda Group of Industries Ltd,,,Hexa Tradex Ltd,,,,,,,,,,,,,,Happiest Minds Technologies Ltd,NBCC (India) Ltd,,,,,,,,Nifty Rural,,,,,,,,,Lincoln Pharmaceuticals Ltd,,,,,,,,,,,Shaival Reality Ltd,,,,,,,,,,,Rama Steel Tubes Ltd,,,,,,Indian Terrain Fashions Ltd,,PDS Ltd,,,,
66,,,,,,,,Sansera Engineering Ltd,,,,,,,,Trom Industries Ltd,United Drilling Tools Ltd,,,,,,Indian Emulsifiers Ltd,,,,,,,,,,,,,,,,,,,,,,Nakoda Group of Industries Ltd Partly Paidup,,,Home First Finance Company India Ltd,,,,,,,,,,,,,,HCL Technologies Ltd,NCC Ltd,,,,,,,,Nifty Smallcap250 Quality 50,,,,,,,,,Lupin Ltd,,,,,,,,,,,Shradha Infraprojects Ltd,,,,,,,,,,,Ramsarup Industries Ltd,,,,,,Indo Count Industries Ltd,,Phoenix Overseas Ltd,,,,
67,,,,,,,,Setco Automotive Ltd,,,,,,,,Ujaas Energy Ltd,Walchandnagar Industries Ltd,,,,,,Indian Phosphate Ltd,,,,,,,,,,,,,,,,,,,,,,Narmada Agrobase Ltd,,,Hybrid Financial Services Ltd,,,,,,,,,,,,,,Hexaware Technologies Ltd,Niraj Cement Structurals Ltd,,,,,,,,Nifty Top 15 Equal Weight,,,,,,,,,Lyka Labs Ltd,,,,,,,,,,,Shree Precoated Steels Ltd,,,,,,,,,,,Ratnamani Metals & Tubes Ltd,,,,,,Indo Rama Synthetics (India) Ltd,,Pramara Promotions Ltd,,,,
68,,,,,,,,Sharda Motor Industries Ltd,,,,,,,,Vdeal System Ltd,Wendt India Ltd,,,,,,Indo Amines Ltd,,,,,,,,,,,,,,,,,,,,,,Nath Bio-Genes (India) Ltd,,,IDFC Ltd,,,,,,,,,,,,,,Hinduja Global Solutions Ltd,Nirlon Ltd,,,,,,,,Nifty Top 20 Equal Weight,,,,,,,,,Mangalam Drugs and Organics Ltd,,,,,,,,,,,Shriram Properties Ltd,,,,,,,,,,,Ratnaveer Precision Engineering Ltd,,,,,,Indus Fila Ltd,,Priya Ltd,,,,
69,,,,,,,,Shigan Quantum Technologies Ltd,,,,,,,,Veto Switchgears & Cables Ltd,Windsor Machines Ltd,,,,,,Indo Borax & Chemicals Ltd,,,,,,,,,,,,,,,,,,,,,,Neha International Ltd,,,Indian Railway Finance Corporation Ltd,,,,,,,,,,,,,,HOV Services Ltd,Noida Toll Bridge Company Ltd,,,,,,,,Nifty200 Value 30,,,,,,,,,Mankind Pharma Ltd,,,,,,,,,,,Shristi Infrastructure Development Corporation Ltd,,,,,,,,,,,Steel Authority of India Ltd,,,,,,Jakharia Fabric Ltd,,Proventus Agrocom Ltd,,,,
70,,,,,,,,Shivam Autotech Ltd,,,,,,,,V-Guard Industries Ltd,Yuken India Ltd,,,,,,Insilco Ltd,,,,,,,,,,,,,,,,,,,,,,Nestle India Ltd,,,IFCI Ltd,,,,,,,,,,,,,,HRH Next Services Ltd,Om Infra Ltd,,,,,,,,Nifty500 Equal Weight,,,,,,,,,Marksans Pharma Ltd,,,,,,,,,,,SignatureGlobal India Ltd,,,,,,,,,,,S.A.L Steel Ltd,,,,,,Jasch Industries Ltd,,Prudential Sugar Corporation Ltd,,,,
71,,,,,,,,Shriram Pistons & Rings Ltd,,,,,,,,Viviana Power Tech Ltd,,,,,,,Ishan Dyes and chemicals Ltd,,,,,,,,,,,,,,,,,,,,,,Nirman Agri Genetics Ltd,,,IIFL Finance Ltd,,,,,,,,,,,,,,ICSA (India) Ltd,P B A Infrastructure Ltd,,,,,,,,Nifty500 LargeMidSmall Equal-Cap Weighted,,,,,,,,,Medicamen Organics Ltd,,,,,,,,,,,Sobha Ltd,,,,,,,,,,,Salasar Techno Engineering Ltd,,,,,,JBF Industries Ltd,,PTC India Ltd,,,,
72,,,,,,,,Sintercom India Ltd,,,,,,,,Voltamp Transformers Ltd,,,,,,,IVP Ltd,,,,,,,,,,,,,,,,,,,,,,Procter & Gamble Hygiene and Health Care Ltd,,,IL&FS Investment Managers Ltd,,,,,,,,,,,,,,Infibeam Avenues Ltd,Patel Engineering Ltd,,,,,,,,Nifty Core Housing,,,,,,,,,Medicamen Biotech Ltd,,,,,,,,,,,Sobha Ltd Partly Paidup,,,,,,,,,,,Sarda Energy & Minerals Ltd,,,,,,JCT Ltd,,Purv Flexipack Ltd,,,,
73,,,,,,,,Sona BLW Precision Forgings Ltd,,,,,,,,Waaree Energies Ltd,,,,,,,J.G.Chemicals Ltd,,,,,,,,,,,,,,,,,,,,,,Parag Milk Foods Ltd,,,India Lease Development Ltd,,,,,,,,,,,,,,InfoBeans Technologies Ltd,Petron Engineering Construction Ltd,,,,,,,,Odigma Consultancy Solutions Ltd,,,,,,,,,Medico Remedies Ltd,,,,,,,,,,,Sumit Woods Ltd,,,,,,,,,,,Sarthak Metals Ltd,,,,,,Jet Knitwears Ltd,,QMS Medical Allied Services Ltd,,,,
74,,,,,,,,Steel Strips Wheels Ltd,,,,,,,,Websol Energy System Ltd,,,,,,,Jayant Agro Organics Ltd,,,,,,,,,,,,,,,,,,,,,,Prataap Snacks Ltd,,,India Shelter Finance Corporation Ltd,,,,,,,,,,,,,,Info-Drive Software Ltd,PNC Infratech Ltd,,,,,,,,OneSource Specialty Pharma Ltd,,,,,,,,,Megasoft Ltd,,,,,,,,,,,Sunteck Realty Ltd,,,,,,,,,,,Sat Industries Ltd,,,,,,Jindal Poly Films Ltd,,Quicktouch Technologies Ltd,,,,
75,,,,,,,,Subros Ltd,,,,,,,,,,,,,,,Jaysynth Orgochem Ltd,,,,,,,,,,,,,,,,,,,,,,Ready Foods Ltd,,,Indian Renewable Energy Development Agency Ltd,,,,,,,,,,,,,,Infosys Ltd,Power Mech Projects Ltd,,,,,,,,P.E. Analytics Ltd,,,,,,,,,Mesco Pharmaceuticals Ltd,,,,,,,,,,,Suraj Estate Developers Ltd,,,,,,,,,,,Sathavahana Ispat Ltd,,,,,,Jindal Worldwide Ltd,,QVC Exports Ltd,,,,
76,,,,,,,,Sundaram Brake Linings Ltd,,,,,,,,,,,,,,,Jocil Ltd,,,,,,,,,,,,,,,,,,,,,,Sameera Agro and Infra Ltd,,,Industrial Investment Trust Ltd,,,,,,,,,,,,,,Innovana Thinklabs Ltd,Pratham EPC Projects Ltd,,,,,,,,Party Cruisers Ltd,,,,,,,,,Mono Pharmacare Ltd,,,,,,,,,,,Suratwwala Business Group Ltd,,,,,,,,,,,Shah Alloys Ltd,,,,,,Jiwanram Sheoduttrai Industries Ltd,,Race Eco Chain Ltd,,,,
77,,,,,,,,Sundram Fasteners Ltd,,,,,,,,,,,,,,,Jubilant Industries Ltd,,,,,,,,,,,,,,,,,,,,,,Sanstar Ltd,,,Indostar Capital Finance Ltd,,,,,,,,,,,,,,Inspirisys Solutions Ltd,Rachana Infrastructure Ltd,,,,,,,,Pentagon Rubber Ltd,,,,,,,,,Morepen Laboratories Ltd,,,,,,,,,,,TARC Ltd,,,,,,,,,,,Shah Metacorp Ltd,,,,,,K G Denim Ltd,,Rajdarshan Industries Ltd,,,,
78,,,,,,,,Suprajit Engineering Ltd,,,,,,,,,,,,,,,Jubilant Ingrevia Ltd,,,,,,,,,,,,,,,,,,,,,,Sanwaria Consumer Ltd,,,Jindal Photo Ltd,,,,,,,,,,,,,,Intellect Design Arena Ltd,Rail Vikas Nigam Ltd,,,,,,,,Prozone Realty Ltd,,,,,,,,,Natco Pharma Ltd,,,,,,,,,,,Techindia Nirman Ltd,,,,,,,,,,,Shyam Metalics & Energy Ltd,,,,,,Kalahridhaan Trendz Ltd,,Rama Petrochemicals Ltd,,,,
79,,,,,,,,Talbros Automotive Components Ltd,,,,,,,,,,,,,,,Kanoria Chemicals & Industries Ltd,,,,,,,,,,,,,,,,,,,,,,Sarveshwar Foods Ltd,,,Jindal Poly Investment & Finance Company Ltd,,,,,,,,,,,,,,Intense Technologies Ltd,Ramky Infrastructure Ltd,,,,,,,,PTL Enterprises Ltd,,,,,,,,,Natural Capsules Ltd,,,,,,,,,,,Texmaco Infrastructure & Holdings Ltd,,,,,,,,,,,Srikalahasthi Pipes Ltd(Merged),,,,,,Karnika Industries Ltd,,Rama Vision Ltd,,,,
80,,,,,,,,Thaai Casting Ltd,,,,,,,,,,,,,,,Kiri Industries Ltd,,,,,,,,,,,,,,,,,,,,,,Shanti Overseas (India) Ltd,,,Jio Financial Services Ltd,,,,,,,,,,,,,,Inventurus Knowledge Solutions Ltd,Reliance Infrastructure Ltd,,,,,,,,R K Swamy Ltd,,,,,,,,,Nectar Lifescience Ltd,,,,,,,,,,,Unitech Ltd,,,,,,,,,,,Steel Exchange India Ltd,,,,,,Ken Enterprises Ltd,,Ramgopal Polytex Ltd,,,,
