,5g,Abrasives,Aerospace-defence,Agro-chemicals,Air-conditioners,Air-transport-service,Alcoholic-beverages,Auto-ancillaries,Automobile,Bpo-and-ites,Banks,Bearings,Biotech,Bluechip,Cables,Capital-goods-electrical-equipment,Capital-goods-non-electrical-equipment,Carbon-black,Castings-forgings-fastners,Cement,Cement-products,Ceramic-products,Chemicals,Compressor,Computer-education,Construction,Consumer-durables,Credit-rating-agencies,Crude-oil-natural-gas,Data-center,Diagnostic,Diamond-gems-and-jewellery,Diversified,Dry-cells,Dyes-and-pigments,E-commerce-app-based-aggregator,Ev-electric-vehicle,Edible-oil,Education,Electronics,Energy,Engineering,Entertainment,Ethanol,Fmcg,Ferro-alloys,Fertilizers,Finance,Financial-services,Fintech,Food,Footwear,Gas-distribution,Glass-glass-products,Green-energy,Green-hydrogen,Healthcare,Hospital,Hotels-restaurants,Household-products,It-hardware,It-software,Infrastructure-developers-operators,Infrastructure-investment-trusts,Insurance,Leather,Logistics,Marine-port-services,Media-print-television-radio,Mining-mineral-products,Miscellaneous,Nbfc,Non-ferrous-metals,Oil-drill-allied,Psu,Packaging,Paints-varnish,Paper,Petrochemicals,Pharmaceuticals,Plantation-plantation-products,Plastic-products,Plywood-boards-laminates,Power-generation-distribution,Power-infrastructure,Printing-stationery,Quick-service-restaurant,Railways,Readymade-garments-apparells,Real-estate-investment-trusts,Realty,Refineries,Refractories,Renewable-energy,Retail,Rubber,Semi-conductor,Ship-building,Shipping,Solar-panel,Solar,Steel,Stock-commodity-brokers,Sugar,Tea-coffee,Telecomm-equipment-infra-services,Telecomm-service,Textiles,Tobacco-products,Trading,Travel-services,Tyres,Water-infra,Wind-energy
0,Reliance Industries Ltd,Carborundum Universal Ltd,Apollo Micro Systems Ltd,Aimco Pesticides Ltd,Amber Enterprises India Ltd,Global Vectra Helicorp Ltd,Allied Blenders & Distillers Ltd,Amara Raja Energy & Mobility Ltd,Ashok Leyland Ltd,eClerx Services Ltd,AU Small Finance Bank Ltd,Bimetal Bearings Ltd,Biocon Ltd,Reliance Industries Ltd,Aksh Optifibre Ltd,ABB India Ltd,Aaron Industries Ltd,Goa Carbon Ltd,Abha Power and Steel Ltd,ACC Ltd,BIGBLOC Construction Ltd,Asian Granito India Ltd,Aarti Industries Ltd,Bright Solar Ltd,Aptech Ltd,Aesthetik Engineers Ltd,Amber Enterprises India Ltd,CARE Ratings Ltd,Aban Offshore Ltd,ABB India Ltd,Fortis Healthcare Ltd,D.P. Abhushan Ltd,3M India Ltd,Eveready Industries India Ltd,AksharChem (India) Ltd,Creative Newtech Ltd,Tata Motors Ltd,Adani Wilmar Ltd,Addictive Learning Technology Ltd,Aimtron Electronics Ltd,Reliance Industries Ltd,Affordable Robotic & Automation Ltd,B A G Films & Media Ltd,EID Parry (India) Ltd,ADF Foods Ltd,Impex Ferro Tech Ltd,Agro Phos India Ltd,Twenty First Century Management Services Ltd,BSE Ltd,Bajaj Finance Ltd,ITC Ltd,Campus Activewear Ltd,Adani Total Gas Ltd,Agarwal Toughened Glass India Ltd,Reliance Industries Ltd,Reliance Industries Ltd,Aatmaj Healthcare Ltd,Apollo Hospitals Enterprise Ltd,A B N Intercorp Ltd,Aarti Surfactants Ltd,AGS Transact Technologies Ltd,3i Infotech Ltd,A B Infrabuild Ltd,Capital Infra Trust,General Insurance Corporation of India,AKI India Ltd,Accuracy Shipping Ltd,Adani Ports & Special Economic Zone Ltd,D B Corp Ltd,20 Microns Ltd,3rd Rock Multimedia Ltd,Aditya Birla Capital Ltd,Arcotech Ltd,Aakash Exploration Services Ltd,Bank of Baroda,A and M Jumbo Bags Ltd,Akzo Nobel India Ltd,Aditya Birla Real Estate Ltd,Agarwal Industrial Corporation Ltd,Aarey Drugs & Pharmaceuticals Ltd,Bengal Tea & Fabrics Ltd,Aeron Composites Ltd,Airo Lam Ltd,Adani Energy Solutions Ltd,Anzen India Energy Yield Plus Trust,Chetana Education Ltd,Barbeque-Nation Hospitality Ltd,Indian Railway Catering & Tourism Corporation Ltd,C P S Shapers Ltd,Brookfield India Real Estate Trust,AGI Infra Ltd,Bharat Petroleum Corporation Ltd,IFGL Refractories Ltd,Reliance Industries Ltd,Aditya Birla Fashion & Retail Ltd,Tube Investments of India Ltd,HCL Technologies Ltd,Bharati Defence & Infrastructure Ltd,ABS Marine Services Ltd,Tata Power Company Ltd,Reliance Industries Ltd,Aditya Ultra Steel Ltd,5Paisa Capital Ltd,Avadh Sugar & Energy Ltd,Andrew Yule & Company Ltd,ADC India Communications Ltd,Accord Synergy Ltd,Aarvee Denims & Exports Ltd,Godfrey Phillips India Ltd,A B M International Ltd,Easy Trip Planners Ltd,Apollo Tyres Ltd,KEC International Ltd,Suzlon Energy Ltd
1,Bharti Airtel Ltd,Grindwell Norton Ltd,Astra Microwave Products Ltd,Ambey Laboratories Ltd,Blue Star Ltd,Interglobe Aviation Ltd,Associated Alcohols & Breweries Ltd,ASK Automotive Ltd,Atul Auto Ltd,Computer Age Management Services Ltd,Axis Bank Ltd,NRB Bearings Ltd,Concord Biotech Ltd,Tata Consultancy Services Ltd,Birla Cable Ltd,Aartech Solonics Ltd,Action Construction Equipment Ltd,PCBL Chemical Ltd,AIA Engineering Ltd,Ambuja Cements Ltd,Everest Industries Ltd,Cera Sanitaryware Ltd,Aarti Surfactants Ltd Partly Paidup,Dynamatic Technologies Ltd,Compucom Software Ltd,Alpine Housing Development Corporation Ltd,Arham Technologies Ltd,CRISIL Ltd,Asian Energy Services Ltd,Cummins India Ltd,Global Health Ltd,Divine Hira Jewellers Ltd,Alchemist Ltd,Indo National Ltd,Asahi Songwon Colors Ltd,Digidrive Distributors Ltd,Bharat Electronics Ltd,Gokul Agro Resources Ltd,Arihant Academy Ltd,Aplab Ltd,Oil And Natural Gas Corporation Ltd,Ameya Precision Engineers Ltd,Balaji Telefilms Ltd,Praj Industries Ltd,Agri-Tech (India) Ltd,Indian Metals & Ferro Alloys Ltd,Aries Agro Ltd,360 ONE WAM Ltd,Central Depository Services (India) Ltd,HDFC Asset Management Company Ltd,Nestle India Ltd,Liberty Shoes Ltd,GAIL (India) Ltd,Asahi India Glass Ltd,Indian Oil Corporation Ltd,NTPC Ltd,Apollo Hospitals Enterprise Ltd,Narayana Hrudayalaya Ltd,Advani Hotels & Resorts (India) Ltd,Ambica Agarbathies & Aroma Industries Ltd,Cerebra Integrated Technologies Ltd,63 Moons Technologies Ltd,A2Z Infra Engineering Ltd,Cube Highways Trust,Go Digit General Insurance Ltd,Bata India Ltd,Allcargo Logistics Ltd,Gujarat Pipavav Port Ltd,Diligent Media Corporation Ltd,Ashapura Minechem Ltd,Aarvi Encon Ltd,Arman Financial Services Ltd,Baheti Recycling Industries Ltd,Dolphin Offshore Enterprises (India) Ltd,State Bank of India,AGI Greenpac Ltd,Asian Paints Ltd,Andhra Paper Ltd,Bhansali Engineering Polymers Ltd,Aarti Drugs Ltd,CCL Products (India) Ltd,Ahimsa Industries Ltd,Archidply Decor Ltd,Adani Green Energy Ltd,Oriana Power Ltd,Doms Industries Ltd,Coffee Day Enterprises Ltd,,Ceenik Exports (India) Ltd,Embassy Office Parks REIT,Ahluwalia Contracts (India) Ltd,Chennai Petroleum Corporation Ltd,Orient Ceratech Ltd,NTPC Ltd,Aditya Birla Fashion & Retail Ltd Partly Paidup,PCBL Chemical Ltd,Bharat Electronics Ltd,Knowledge Marine & Engineering Works Ltd,Arvind Port & Infra Ltd,Sterling and Wilson Renewable Energy Ltd,NTPC Ltd,Aeroflex Industries Ltd,Aditya Birla Money Ltd,Bajaj Hindusthan Sugar Ltd,Goodricke Group Ltd,Frog Cellsat Ltd,Bharti Airtel Ltd,AB Cotspin India Ltd,ITC Ltd,A G Universal Ltd,Indian Railway Catering & Tourism Corporation Ltd,Balkrishna Industries Ltd,NCC Ltd,Orient Green Power Company Ltd
2,Tech Mahindra Ltd,Wendt (India) Ltd,Avantel Ltd,Aristo Bio-Tech & Lifescience Ltd,Voltas Ltd,Jet Airways (India) Ltd,Aurangabad Distillery Ltd,ASL Industries Ltd,Bajaj Auto Ltd,CMS Info Systems Ltd,Bandhan Bank Ltd,NRB Industrial Bearings Ltd,Rossari Biotech Ltd,HDFC Bank Ltd,CMI Ltd,Advance Metering Technology Ltd,Ador Welding Ltd,Rain Industries Ltd,Alicon Castalloy Ltd,Andhra Cements Ltd,Hil Ltd,Euro Ceramics Ltd,Aarti Surfactants Ltd,Elgi Equipments Ltd,Educomp Solutions Ltd,Aluwind Architectural Ltd,Aro Granite Industries Ltd,ICRA Ltd,Deep Energy Resources Ltd,Hitachi Energy India Ltd,Dr. Lal Pathlabs Ltd,Gitanjali Gems Ltd,Andrew Yule & Company Ltd,Panasonic Energy India Company Ltd,Bhageria Industries Ltd,Easy Trip Planners Ltd,Samvardhana Motherson International Ltd,Gokul Refoils and Solvent Ltd,CL Educate Ltd,Centum Electronics Ltd,Indian Oil Corporation Ltd,Atam Valves Ltd,Basilic Fly Studio Ltd,Balrampur Chini Mills Ltd,Agro Tech Foods Ltd,Jainam Ferro Alloys (I) Ltd,Balaji Phosphates Ltd,3P Land Holdings Ltd,Computer Age Management Services Ltd,PB Fintech Ltd,Varun Beverages Ltd,Mirza International Ltd,Gujarat State Petronet Ltd,Banaras Beads Ltd,Adani Green Energy Ltd,Adani Enterprises Ltd,Aprameya Engineering Ltd,Krishna Institute of Medical Sciences Ltd,Apeejay Surrendra Park Hotels Ltd,Bajaj Consumer Care Ltd,Control Print Ltd,AAA Technologies Ltd,Abhishek Integrations Ltd,Highways Infrastructure Trust,HDFC Life Insurance Company Ltd,Bhartiya International Ltd,Amiable Logistics India Ltd,JSW Infrastructure Ltd,Graphisads Ltd,Asi Industries Ltd,Allcargo Terminals Ltd,Bajaj Holdings & Investment Ltd,Century Extrusions Ltd,Jindal Drilling & Industries Ltd,Bharat Petroleum Corporation Ltd,AMD Industries Ltd,Berger Paints India Ltd,Astron Paper & Board Mill Ltd,DCW Ltd,Aarti Pharmalabs Ltd,Dhunseri Tea & Industries Ltd,Apollo Pipes Ltd,Archidply Industries Ltd,Adani Power Ltd,,Flair Writing Industries Ltd,Devyani International Ltd,,Dollar Industries Ltd,Mindspace Business Parks REIT,Ajmera Realty & Infra India Ltd,Gandhar Oil Refinery (India) Ltd,Raghav Productivity Enhancers Ltd,Indian Oil Corporation Ltd,Aditya Vision Ltd,NOCIL Ltd,Vedanta Ltd,Swan Defence and Heavy Industries Ltd,Chowgule Steamships Ltd,Websol Energy Systems Ltd,Adani Green Energy Ltd,Ahlada Engineers Ltd,Almondz Global Securities Ltd,Balrampur Chini Mills Ltd,Warren Tea Ltd,GTL Infrastructure Ltd,Bharti Airtel Ltd Partly Paidup,Aditya Spinners Ltd,VST Industries Ltd,Adani Enterprises Ltd,Thomas Cook (India) Ltd,CEAT Ltd,Va Tech Wabag Ltd,Karma Energy Ltd
3,Indus Towers Ltd,,Azad Engineering Ltd,Astec Lifesciences Ltd,Johnson Controls-Hitachi Air Conditioning India Ltd,SpiceJet Ltd,BCL Industries Ltd,Automobile Corporation Of Goa Ltd,Bikewo Green Tech Ltd,Hinduja Global Solutions Ltd,Bank of Baroda,Schaeffler India Ltd,Windlas Biotech Ltd,Bharti Airtel Ltd,Cords Cable Industries Ltd,Agni Green Power Ltd,Ajax Engineering Ltd,,Balu Forge Industries Ltd,Anjani Portland Cement Ltd,Ramco Industries Ltd,Exxaro Tiles Ltd,Aether Industries Ltd,Ingersoll-Rand (India) Ltd,NIIT Ltd,Art Nirman Ltd,Atlas Cycles (Haryana) Ltd,,Deep Industries Ltd,Voltas Ltd,Vijaya Diagnostic Centre Ltd,Goenka Diamond & Jewels Ltd,Balmer Lawrie & Company Ltd,,Bodal Chemicals Ltd,Forcas Studio Ltd,Bosch Ltd,JVL Agro Industries Ltd,CP Capital Limited,Cyient DLM Ltd,Bharat Petroleum Corporation Ltd,ATV Projects India Ltd,Baweja Studios Ltd,Triveni Engineering & Industries Ltd,Ajooni Biotech Ltd,Maithan Alloys Ltd,Bohra Industries Ltd,Aadhar Housing Finance Ltd,Indian Energy Exchange Ltd,One97 Communications Ltd,Godrej Consumer Products Ltd,Relaxo Footwears Ltd,Gujarat Gas Ltd,Borosil Ltd,GAIL (India) Ltd,Indian Oil Corporation Ltd,Artemis Medicare Services Ltd,Dr. Lal Pathlabs Ltd,Apollo Sindoori Hotels Ltd,Colgate-Palmolive (India) Ltd,Esconet Technologies Ltd,Accelya Solutions India Ltd,ACME Solar Holdings Ltd,IndiGrid Infrastructure Trust,ICICI Lombard General Insurance Company Ltd,Campus Activewear Ltd,Arshiya Ltd,,H T Media Ltd,Coal India Ltd,Alphageo (India) Ltd,Bajaj Finance Ltd,Cubex Tubings Ltd,,MMTC Ltd,Antarctica Ltd,Indigo Paints Ltd,B&B Triplewall Containers Ltd,Goa Carbon Ltd,Abbott India Ltd,Duncans Industries Ltd,Arrow Greentech Ltd,Century Plyboards (India) Ltd,BF Utilities Ltd,,Infomedia Press Ltd,Grill Splendour Services Ltd,,Gokaldas Exports Ltd,Nexus Select Trust,Alembic Ltd,Hindustan Petroleum Corporation Ltd,Refractory Shapes Ltd,Adani Green Energy Ltd,Allcargo Gati Ltd,Apcotex Industries Ltd,CG Power and Industrial Solutions Ltd,,Essar Shipping Ltd,Borosil Renewables Ltd,Tata Power Company Ltd,Ankit Metal & Power Ltd,Angel One Ltd,Bannari Amman Sugars Ltd,CCL Products India Ltd,HFCL Ltd,Bharti Hexacom Ltd,AI Champdany Industries Ltd,Golden Tobacco Ltd,Aegis Logistics Ltd,,Emerald Tyre Manufacturers Ltd,Ion Exchange (India) Ltd,
4,Vodafone Idea Ltd,,BEML Ltd,Bayer CropScience Ltd,,,G M Breweries Ltd,Autoline Industries Ltd,Delta Autocorp Ltd,Intrasoft Technologies Ltd,Bank of India,SKF India Ltd,Medicamen Biotech Ltd,ICICI Bank Ltd,DCG Cables & Wires Ltd,Akanksha Power & Infrastructure Ltd,Apex Ecotech Ltd,,Bharat Forge Ltd,Barak Valley Cements Ltd,Sahyadri Industries Ltd,Kajaria Ceramics Ltd,AksharChem (India) Ltd,Shakti Pumps (India) Ltd,NIIT Learning Systems Ltd,B.L.Kashyap & Sons Ltd,Avalon Technologies Ltd,,Hindustan Oil Exploration Company Ltd,Blue Star Ltd,Metropolis Healthcare Ltd,Goldiam International Ltd,DCM Shriram Ltd,,Dynemic Products Ltd,FSN E-Commerce Ventures Ltd,Hero MotoCorp Ltd,KN Agri Resources Ltd,Docmode Health Technologies Ltd,Five Core Electronics Ltd,GAIL (India) Ltd,BEW Engineering Ltd,Bodhi Tree Multimedia Ltd,Shree Renuka Sugars Ltd,Annapurna Swadisht Ltd,Shyam Century Ferrous Ltd,Chambal Fertilisers & Chemicals Ltd,AAVAS Financiers Ltd,KFin Technologies Ltd,Central Depository Services (India) Ltd,Britannia Industries Ltd,Superhouse Ltd,Indraprastha Gas Ltd,Borosil Renewables Ltd,Tata Power Company Ltd,Adani Green Energy Ltd,Aster DM Healthcare Ltd,Vijaya Diagnostic Centre Ltd,Aruna Hotels Ltd,Dabur India Ltd,HCL Infosystems Ltd,Ace Integrated Solutions Ltd,Afcons Infrastructure Ltd,Indus Infra Trust,ICICI Prudential Life Insurance Company Ltd,Khadim India Ltd,Ashapura Logistics Ltd,,Hindustan Media Ventures Ltd,Esprit Stones Ltd,ANI Integrated Services Ltd,Capital Trust Ltd,Divine Power Energy Ltd,,Rashtriya Chemicals & Fertilizers Ltd,Anya Polytech & Fertilizers Ltd,Kansai Nerolac Paints Ltd,Balkrishna Paper Mills Ltd,Kothari Petrochemicals Ltd,Accent Microcell Ltd,Elgi Rubber Company Ltd,Astral Ltd,Greenlam Industries Ltd,Bhagyanagar India Ltd,,Kokuyo Camlin Ltd,Jubilant Foodworks Ltd,,Haria Exports Ltd,,AMJ Land Holdings Ltd,Indian Oil Corporation Ltd,RHI Magnesita India Ltd,GAIL (India) Ltd,Archies Ltd,GRP Ltd,Dixon Technologies (India) Ltd,,Great Eastern Shipping Company Ltd,,JSW Energy Ltd,APL Apollo Tubes Ltd,Arihant Capital Markets Ltd,Dalmia Bharat Sugar & Industries Ltd,The Grob Tea Company Ltd,Indus Towers Ltd,GTL Ltd,Akshar Spintex Ltd,,Agarwal Float Glass India Ltd,,Goodyear India Ltd,KNR Constructions Ltd,
5,ITI Ltd,,Bharat Dynamics Ltd,Best Agrolife Ltd,,,Globus Spirits Ltd,Automotive Axles Ltd,Eicher Motors Ltd,Matrimony.com Ltd,Bank of Maharashtra,SKP Bearing Industries Ltd,Ajooni Biotech Ltd,Infosys Ltd,Diamond Power Infrastructure Ltd,Alpex Solar Ltd,Auro Impex & Chemicals Ltd,,CIE Automotive India Ltd,Birla Corporation Ltd,Visaka Industries Ltd,Lexus Granito (India) Ltd,Alkali Metals Ltd,,Usha Martin Education & Solutions Ltd,BDR Buildcon Ltd,Bajaj Electricals Ltd,,Oil & Natural Gas Corpn Ltd,Anant Raj Ltd,Thyrocare Technologies Ltd,Kabra Jewels Ltd,Ecoboard Industries Ltd,,Kiri Industries Ltd,IBL Finance Ltd,UNO Minda Ltd,Kriti Nutrients Ltd,Drone Destination Ltd,Honeywell Automation India Ltd,Hindustan Petroleum Corporation Ltd,Boss Packaging Solutions Ltd,Cineline India Ltd,Bajaj Hindusthan Sugar Ltd,Apex Frozen Foods Ltd,Visa Steel Ltd,Coromandel International Ltd,Abans Holdings Ltd,Multi Commodity Exchange of India Ltd,Computer Age Management Services Ltd,United Spirits Ltd,,IRM Energy Ltd,Borosil Scientific Ltd,JSW Energy Ltd,Bharat Petroleum Corporation Ltd,Chandan Healthcare Ltd,Metropolis Healthcare Ltd,Asian Hotels (East) Ltd,Emami Ltd,Netweb Technologies India Ltd,Adroit Infotech Ltd,AJR Infra & Tolling Ltd,Interise Trust,Life Insurance Corporation of India,Liberty Shoes Ltd,Aspinwall & Company Ltd,,Jagran Prakashan Ltd,Gujarat Mineral Development Corporation Ltd,Anlon Technology Solutions Ltd,Central Depository Services (India) Ltd,Euro Panel Products Ltd,,Bharat Electronics Ltd,Barflex Polyfilms Ltd,MCON Rasayan India Ltd,Ballarpur Industries Ltd,Manali Petrochemicals Ltd,Advanced Enzyme Technologies Ltd,Gayatri Rubbers and Chemicals Ltd,Avro India Ltd,Greenpanel Industries Ltd,CESC Ltd,,Linc Ltd,Restaurant Brands Asia Ltd,,Iris Clothings Ltd,,Anant Raj Ltd,Mangalore Refinery And Petrochemicals Ltd,SP Refractories Ltd,JSW Energy Ltd,Arvind Fashions Ltd Partly Paidup,Somi Conveyor Beltings Ltd,Tata Elxsi Ltd,,Global Offshore Services Ltd,,NHPC Ltd,Bansal Wire Industries Ltd,BLB Ltd,Davangere Sugar Company Ltd,Tata Consumer Products Ltd,Kore Digital Ltd,Hathway Cable & Datacom Ltd,Alok Industries Ltd,,AKG Exim Ltd,,Govind Rubber Ltd,PNC Infratech Ltd,
6,Tejas Networks Ltd,,Bharat Electronics Ltd,Bhagiradha Chemicals & Industries Ltd,,,Gulshan Polyols Ltd,Automotive Stampings & Assemblies Ltd,Escorts Kubota Ltd,Info Edge (India) Ltd,Canara Bank,Timken India Ltd,Indegene Ltd,State Bank of India,Dynamic Cables Ltd,Apar Industries Ltd,Batliboi Ltd,,DCM Ltd,Burnpur Cement Ltd,,Murudeshwar Ceramics Ltd,Alkyl Amines Chemicals Ltd,,Vinsys IT Services India Ltd,BEML Land Assets Ltd,Blue Star Ltd,,Oil India Ltd,KEC International Ltd,Krsnaa Diagnostics Ltd,Kalyan Jewellers India Ltd,Indifra Ltd,,Poddar Pigments Ltd,Indiamart Intermesh Ltd,Bharat Forge Ltd,M K Proteins Ltd,DSJ Keep Learning Ltd,Kernex Microsystems (India) Ltd,Suzlon Energy Ltd,Cimmco Ltd,Cinevista Ltd,Dalmia Bharat Sugar and Industries Ltd,Avanti Feeds Ltd,,Fertilizers & Chemicals Travancore Ltd,Aditya Birla Sun Life AMC Ltd,,Tanla Platforms Ltd,Tata Consumer Products Ltd,,Mahanagar Gas Ltd,Hindusthan National Glass & Industries Ltd,Exide Industries Ltd,GAIL (India) Ltd,Dr Agarwals Health Care Ltd,Indraprastha Medical Corporation Ltd,Asian Hotels (North) Ltd,Galaxy Surfactants Ltd,Panache Digilife Ltd,Adroit Infotech Ltd Partly Paidup,Akash Infraprojects Ltd,IRB Infrastructure Trust,Medi Assist Healthcare Services Ltd,Mayur Uniquoters Ltd,AVG Logistics Ltd,,Madhya Pradesh Today Media Ltd,Greenearth Resources & Projects Ltd,Antony Waste Handling Cell Ltd,Cholamandalam Investment & Finance Company Ltd,Galada Power & Telecommunication Ltd,,Steel Authority of India (SAIL) Ltd,BKM Industries Ltd,Shalimar Paints Ltd,Emami Paper Mills Ltd,Panama Petrochem Ltd,Ajanta Pharma Ltd,Gillanders Arbuthnot & Company Ltd,AVSL Industries Ltd,Greenply Industries Ltd,Energy Development Company Ltd,,Navneet Education Ltd,Sapphire Foods India Ltd,,K P R Mill Ltd,,Ansal Housing Ltd,Reliance Industries Ltd Partly Paidup,Vesuvius India Ltd,Inox Wind Ltd,Avenue Supermarts Ltd,Oriental Carbon & Chemicals Ltd,MIC Electronics Ltd,,Mercator Ltd,,Torrent Power Ltd,Bedmutha Industries Ltd,DB (International) Stock Brokers Ltd,DCM Shriram Industries Ltd,Jay Shree Tea & Industries Ltd,MRO-TEK Realty Ltd,Mahanagar Telephone Nigam Ltd,Alps Industries Ltd,,Anik Industries Ltd,,Innovative Tyres & Tubes Ltd,Jash Engineering Ltd,
7,HFCL Ltd,,C2C Advanced Systems Ltd,Bharat Rasayan Ltd,,,IFB Agro Industries Ltd,Autopal Industries Ltd,Force Motors Ltd,Quadpro ITeS Ltd,Capital Small Finance Bank Ltd,,Aristo Bio-Tech and Lifescience Ltd,ITC Ltd,Finolex Cables Ltd,Australian Premium Solar (India) Ltd,Carborundum Universal Ltd,,Deem Roll-Tech Ltd,Dalmia Bharat Ltd,,Orient Bell Ltd,Ambani Orgochem Ltd,,Zee Learn Ltd,C & C Constructions Ltd,BPL Ltd,,Selan Explorations Technology Ltd,Amber Enterprises India Ltd,Nidan Laboratories And Healthcare Ltd,Kanani Industries Ltd,Mafatlal Industries Ltd,,Shree Pushkar Chemicals & Fertilisers Ltd,Info Edge (India) Ltd,Sona BLW Precision Forgings Ltd,Marico Ltd,Global Education Ltd,Nitiraj Engineers Ltd,Oil India Ltd,Creative Graphics Solutions India Ltd,Creative Eye Ltd,,AVT Natural Products Ltd,,Gujarat State Fertilizers & Chemicals Ltd,Aditya Birla Capital Ltd,,Zaggle Prepaid Ocean Services Ltd,Dabur India Ltd,,Petronet LNG Ltd,La Opala RG Ltd,Inox Wind Ltd,Oil India Ltd,Dr Lal Pathlabs Ltd,Rainbow Childrens Medicare Ltd,Asian Hotels (West) Ltd,Gillette India Ltd,Richa Info Systems Ltd,Aeonx Digital Technology Ltd,ARSS Infrastructure Projects Ltd,IRB InvIT Fund,New India Assurance Company Ltd,Metro Brands Ltd,Balurghat Technologies Ltd,,New Delhi Television Ltd,Innomet Advanced Materials Ltd,Ashram Online.com Ltd,Consolidated Finvest & Holdings Ltd,Gravita India Ltd,,NLC India Ltd,Bulkcorp International Ltd,,Genus Paper & Boards Ltd,Savita Oil Technologies Ltd,Akums Drugs & Pharmaceuticals Ltd,Goodricke Group Ltd,Beardsell Ltd,Milton Industries Ltd,Gujarat Industries Power Co Ltd,,Repro India Ltd,Westlife Foodworld Ltd,,Kewal Kiran Clothing Ltd,,Ansal Properties & Infrastructure Ltd,Reliance Industries Ltd,,Indian Energy Exchange Ltd,Baazar Style Retail Ltd,Pix Transmissions Ltd,,,Shipping Corporation of India Ltd,,Sterling and Wilson Renewable Energy Ltd,Bharat Wire Ropes Ltd,Emkay Global Financial Services Ltd,Dhampur Bio Organics Ltd,McLeod Russel (India) Ltd,NELCO Ltd,Nazara Technologies Ltd,Amarjothi Spinning Mills Ltd,,Anmol India Ltd,,JK Tyre & Industries Ltd,,
8,Sterlite Technologies Ltd,,Cochin Shipyard Ltd,Crop Life Science Ltd,,,India Glycols Ltd,Banco Products (India) Ltd,Hero MotoCorp Ltd,Vakrangee Ltd,Central Bank of India,,,Hindustan Unilever Ltd,Godha Cabcon and Insulation Ltd,Bharat Heavy Electricals Ltd,Concord Enviro Systems Ltd,,EL Forge Ltd,Deccan Cements Ltd,,Regency Ceramics Ltd,Ambica Agarbathies Aroma & Industries Ltd,,,Consolidated Construction Consortium Ltd,Butterfly Gandhimathi Appliances Ltd,,,Kirloskar Oil Engines Ltd,,Manoj Vaibhav Gems N Jewellers Ltd,Nava Ltd,,Sudarshan Chemical Industries Ltd,Intrasoft Technologies Ltd,Exide Industries Ltd,N K Industries Ltd,G-Tec Janix Education Ltd,Pulz Electronics Ltd,Linde India Ltd,Emkay Taps & Cutting Tools Ltd,Cyber Media (India) Ltd,,Baba Food Processing India Ltd,,Khaitan Chemicals & Fertilizers Ltd,Akiko Global Services Ltd,,,Marico Ltd,,Positron Energy Ltd,Sejal Glass Ltd,Indian Energy Exchange Ltd,,Fortis Healthcare Ltd,Jupiter Life Line Hospitals Ltd,Blue Coast Hotels Ltd,Godrej Consumer Products Ltd,Slone Infosystems Ltd,Affle India Ltd,Artson Ltd,National Highways Infra Trust,Niva Bupa Health Insurance Company Ltd,Mideast (India) Ltd,Blue Dart Express Ltd,,Network 18 Media & Investments Ltd,KIOCL Ltd,AWFIS Space Solutions Ltd,Coral India Finance and Housing Ltd,GSM Foils Ltd,,National Aluminium Company Ltd,Commercial Syn Bags Ltd,,JK Paper Ltd,Styrenix Performance Materials Ltd,Albert David Ltd,The Grob Tea Co Ltd,Bright Brothers Ltd,Rushil Decor Ltd,India Power Corporation Ltd,,S Chand & Company Ltd,,,Kitex Garments Ltd,,Arihant Superstructures Ltd,,,Olectra Greentech Ltd,Brainbees Solutions Ltd,Rubfila International Ltd,,,Sadhav Shipping Ltd,,KPI Green Energy Ltd,Bihar Sponge Iron Ltd,Geojit Financial Services Ltd,Dhampur Sugar Mills Ltd,Rossell India Ltd,Nu Tek India Ltd,OnMobile Global Ltd,Ambika Cotton Mills Ltd,,Arvind Fashions Ltd,,MRF Ltd,,
9,Mahanagar Telephone Nigam Ltd,,Data Patterns (India) Ltd,Dhanuka Agritech Ltd,,,Jagatjit Industries Ltd,Bharat Gears Ltd,Hindustan Motors Ltd,,City Union Bank Ltd,,,HCL Technologies Ltd,KEI Industries Ltd,Bharat Bijlee Ltd,Cummins India Ltd,,Electrosteel Castings Ltd,HeidelbergCement India Ltd,,Somany Ceramics Ltd,Amines & Plasticizers Ltd,,,Chavda Infra Ltd,Carysil Ltd,,,RailTel Corporation of India Ltd,,Motisons Jewellers Ltd,Quess Corp Ltd,,Vidhi Specialty Food Ingredients Ltd,Just Dial Ltd,Endurance Technologies Ltd,Patanjali Foods Ltd,LCC Infotech Ltd,Sahasra Electronic Solutions Ltd,Petronet LNG Ltd,Envirotech Systems Ltd,Den Networks Ltd,,Bajaj Consumer Care Ltd,,Krishana Phoschem Ltd,Akme Fintrade (India) Ltd,,,Patanjali Foods Ltd,,,Triveni Glass Ltd,Praj Industries Ltd,,Global Health Ltd,Yatharth Hospital & Trauma Care Services Ltd,Chalet Hotels Ltd,Hindustan Unilever Ltd,TVS Electronics Ltd,Aion-Tech Solutions Ltd,Ashoka Buildcon Ltd,NDR INVIT Trust,SBI Life Insurance Company Ltd,Mirza International Ltd,Brace Port Logistics Ltd,,SAB Events & Governance Now Media Ltd,Lloyds Metals & Energy Ltd,Banka Bioloo Ltd,CreditAccess Grameen Ltd,Gujarat Cypromet Ltd,,Hindustan Petroleum Corporation Ltd,Cosmo First Ltd,,Kuantum Papers Ltd,Supreme Petrochem Ltd,Alembic Pharmaceuticals Ltd,GRP Ltd,Caprihans India Ltd,Stylam Industries Ltd,Indowind Energy Ltd,,Sundaram Multi Pap Ltd,,,Page Industries Ltd,,Arkade Developers Ltd,,,Sterling and Wilson Renewable Energy Ltd,Brand Concepts Ltd,Gayatri Rubbers and Chemicals Ltd,,,Transworld Shipping Lines Ltd,,Websol Energy Systems Ltd,Bil Energy System Ltd,ICICI Securities Ltd,Dharani Sugars & Chemicals Ltd,The United Nilgiri Tea Estates Company Ltd,Punjab Communications Ltd,Railtel Corporation of India Ltd,Amit Spinning Industries Ltd,,Ashoka Metcast Ltd,,Tolins Tyres Ltd,,
