10,,,DCX Systems Ltd,Dharmaj Crop Guard Ltd,,,Piccadily Sugar & Allied Inds Ltd,Bharat Seats Ltd,Hyundai Motor India Ltd,,CSB Bank Ltd,,,Bajaj Finance Ltd,Marco Cables & Conductors Ltd,Bright Solar Ltd,DE Nora India Ltd,,Forge Auto International Ltd,India Cements Ltd,,,Andhra Petrochemicals Ltd,,,CMM Infraprojects Ltd,Crompton Greaves Consumer Electricals Ltd,,,Aurionpro Solutions Ltd,,P N Gadgil Jewellers Ltd,Spectrum Talent Management Ltd,,,Kaushalya Logistics Ltd,Himadri Speciality Chemical Ltd,Raj Oil Mills Ltd,Moxsh Overseas Educon Ltd,Spel Semiconductor Ltd,Gujarat Gas Ltd,Falcon Technoprojects India Ltd,Digicontent Ltd,,Bikaji Foods International Ltd,,Madhya Bharat Agro Products Ltd,Alfred Herbert (India) Ltd,,,United Breweries Ltd,,,,Olectra Greentech Ltd,,GPT Healthcare Ltd,GPT Healthcare Ltd,Country Club Hospitality & Holidays Ltd,Jyothy Labs Ltd,VXL Instruments Ltd,Airan Ltd,Atal Realtech Ltd,Nxt-Infra Trust,Star Health & Allied Insurance Company Ltd,Relaxo Footwears Ltd,Committed Cargo Care Ltd,,Sambhaav Media Ltd,Madhav Copper Ltd,Binani Industries Ltd,Crest Ventures Ltd,Hindalco Industries Ltd,,Bharat Heavy Electricals Ltd,D.K. Enterprises Global Ltd,,Magnum Ventures Ltd,Tamil Nadu Petro Products Ltd,Alivus Life Sciences Ltd,Harrisons Malayalam Ltd,Cool Caps Industries Ltd,Western India Plywoods Ltd,Inox Wind Energy Ltd,,,,,Pearl Global Industries Ltd,,Arvind SmartSpaces Ltd,,,,Cartrade Tech Ltd,,,,Varun Shipping Company Ltd,,Borosil Renewables Ltd,Chaman Metallics Ltd,IIFL Capital Services Ltd,Dollex Agrotech Ltd,,Sar Televenture Ltd,Reliance Communications Ltd,Artedz Fabs Ltd,,Aspire & Innovative Advertising Ltd,,TVS Srichakra Ltd,,
11,,,Garden Reach Shipbuilders & Engineers Ltd,Excel Industries Ltd,,,Pincon Spirit Ltd,Bombay Burmah Trading Corporation Ltd,Indo Farm Equipment Ltd,,DCB Bank Ltd,,,Sun Pharmaceutical Industries Ltd,Nicco Corporation Ltd,CG Power & Industrial Solutions Ltd,Diffusion Engineers Ltd,,Gala Precision Engineering Ltd,J K Cements Ltd,,,Andhra Sugars Ltd,,,Deepak Builders & Engineers India Ltd,Delta Manufacturing Ltd,,,,,PC Jeweller Ltd,Swan Energy Ltd,,,Le Travenues Technology Ltd,,Rajgor Castor Derivatives Ltd,MT Educare Ltd,Syrma SGS Technology Ltd,Mangalore Refinery And Petrochemicals Ltd,Global Pet Industries Ltd,Digikore Studios Ltd,,Bombay Super Hybrid Seeds Ltd,,Madras Fertilizers Ltd,Amforge Industries Ltd,,,Jubilant Foodworks Ltd,,,,Sterling and Wilson Renewable Energy Ltd,,Healthcare Global Enterprises Ltd,,EIH Ltd,Omfurn India Ltd,Zenith Computers Ltd,Alankit Ltd,Atlantaa Ltd,Oriental Infra Trust,,Superhouse Ltd,Container Corporation Of India Ltd,,Sandesh Ltd,Metkore Alloys & Industries Ltd,Blue Pebble Ltd,Edelweiss Financial Services Ltd,Hindustan Copper Ltd,,ITI Ltd,Emmbi Industries Ltd,,Malu Paper Mills Ltd,,Alkem Laboratories Ltd,International Conveyors Ltd,Essen Speciality Films Ltd,,Jaiprakash Power Ventures Ltd,,,,,Rupa & Company Ltd,,Ashiana Housing Ltd,,,,Cell Point (India) Ltd,,,,,,,D P Wires Ltd,Indbank Merchant Banking Services Ltd,Dwarikesh Sugar Industries Ltd,,Suyog Telematics Ltd,Tata Communications Ltd,Arvind Ltd,,Ausom Enterprise Ltd,,Viaz Tyres Ltd,,
12,,,Hindustan Aeronautics Ltd,Heranba Industries Ltd,,,Pioneer Distilleries Ltd,Bosch Ltd,Mahindra & Mahindra Ltd,,Dhanlaxmi Bank Ltd,,,Maruti Suzuki India Ltd,Paramount Communications Ltd,Danish Power Ltd,Disa India Ltd,,Ganga Forging Ltd,JK Lakshmi Cement Ltd,,,Anupam Rasayan India Ltd,,,Denta Water & Infra Solutions Ltd,Dixon Technologies (India) Ltd,,,,,Penta Gold Ltd,Tara Chand Infralogistic Solutions Ltd,,,Macobs Technologies Ltd,,Ramdevbaba Solvent Ltd,Tree House Education & Accessories Ltd,Vinyas Innovative Technologies Ltd,Gujarat State Petronet Ltd,HMT Ltd,Dish TV India Ltd,,Britannia Industries Ltd,,Mangalore Chemicals & Fertilizers Ltd,Anand Rathi Wealth Ltd,,,Radico Khaitan Ltd,,,,Websol Energy Systems Ltd,,Indegene Ltd,,EIH Associated Hotels Ltd,Parin Enterprises Ltd,,All E Technologies Ltd,Atmastco Ltd,Powergrid Infrastructure Investment Trust,,Zenith Exports Ltd,Deccan Transcon Leasing Ltd,,T.V. Today Network Ltd,MOIL Ltd,CMS Info Systems Ltd,HB Stockholdings Ltd,Hindustan Zinc Ltd,,Mangalore Refinery And Petrochemicals Ltd,EPL Ltd,,N R Agarwal Industries Ltd,,Alpa Laboratories Ltd,Jay Shree Tea & Industries Ltd,Finolex Industries Ltd,,JSW Energy Ltd,,,,,Thomas Scott India Ltd,,Baroda Rayon Corporation Ltd,,,,Cellecor Gadgets Ltd,,,,,,,DEE Development Engineers Ltd,Indo Thai Securities Ltd,EID Parry (India) Ltd,,Tejas Networks Ltd,Tata Teleservices (Maharashtra) Ltd,Ashapura Intimates Fashion Ltd,,B.C. Power Controls Ltd,,,,
13,,,Ideaforge Technology Ltd,India Pesticides Ltd,,,Radico Khaitan Ltd,Carraro India Ltd,Maruti Suzuki India Ltd,,Equitas Small Finance Bank Ltd,,,Mahindra & Mahindra Ltd,Plaza Wires Ltd,Easun Reyrolle Ltd,Dynamatic Technologies Ltd,,Gontermann Peiper (India) Ltd,K C P Ltd,,,Apcotex Industries Ltd,,,Destiny Logistics & Infra Ltd,Durlax Top Surface Ltd,,,,,Radhika Jeweltech Ltd,TTK Healthcare Ltd,,,MOS Utility Ltd,,Shree Ram Proteins Ltd,Veranda Learning Solutions Ltd,,Castrol India Ltd,Holmarc Opto-Mechatronics Ltd,DQ Entertainment International Ltd,,Chamanlal Setia Exports Ltd,,Nagarjuna Fertilizers & Chemicals Ltd,Apple Credit Corporation Ltd,,,Emami Ltd,,,,Borosil Renewables Ltd,,Indraprastha Medical Corporation Ltd,,GIR Natureview Resorts Ltd,Procter & Gamble Hygiene & Healthcare Ltd,,Alldigi Tech Ltd,AVP Infracon Ltd,Roadstar Infra Investment Trust,,,Delhivery Ltd,,TV18 Broadcast Ltd,NMDC Ltd,Coastal Corporation Ltd Partly Paidup,IDFC Ltd,Maan Aluminium Ltd,,Hindustan Copper Ltd,Ester Industries Ltd,,Orient Paper & Industries Ltd,,Ambalal Sarabhai Enterprises Ltd,Lead Reclaim and Rubber Products Ltd,Jai Corp Ltd,,Karma Energy Ltd,,,,,Vedant Fashions Ltd,,Brigade Enterprises Ltd,,,,Credo Brands Marketing Ltd,,,,,,,Electrotherm (India) Ltd,Inventure Growth & Securities Ltd,Empee Sugars & Chemicals Ltd,,,Uniinfo Telecom Services Ltd,Ashima Ltd,,Bang Overseas Ltd,,,,
14,,,ITI Ltd,Insecticides India Ltd,,,Ravikumar Distilleries Ltd,Craftsman Automation Ltd,Olectra Greentech Ltd,,ESAF Small Finance Bank Ltd,,,Oil And Natural Gas Corporation Ltd,Polycab India Ltd,Electro Force (India) Ltd,Eimco Elecon (India) Ltd,,Happy Forgings Ltd,Kakatiya Cement Sugar & Industries Ltd,,,Arabian Petroleum Ltd,,,Dhanuka Realty Ltd,Elin Electronics Ltd,,,,,Rajesh Exports Ltd,Vikas Ecotech Ltd,,,MSTC Ltd,,Vegepro Foods & Feeds Ltd,Winny Immigration & Education Services Ltd,,Mahanagar Gas Ltd,HVAX Technologies Ltd,Entertainment Network (India) Ltd,,Coastal Corporation Ltd,,National Fertilizer Ltd,Aptus Value Housing Finance India Ltd,,,Godfrey Phillips India Ltd,,,,,,Jupiter Life Line Hospitals Ltd,,HLV Ltd,Safari Industries (India) Ltd,,Allied Digital Services Ltd,Bajel Projects Ltd,Shrem InvIT,,,DJ Mediaprint & Logistics Ltd,,UFO Moviez India Ltd,Orissa Minerals Development Company Ltd,Confidence Petroleum India Ltd,Industrial Investment Trust Ltd,Manaksia Aluminium Company Ltd,,Oil India Ltd,Everest Kanto Cylinder Ltd,,Pakka Ltd,,Ami Organics Ltd,Mcleod Russel India Ltd,Jain Irrigation Systems Ltd-DVR,,KPI Green Energy Ltd,,,,,Veekayem Fashion & Apparels Ltd,,Capacite Infraprojects Ltd,,,,Electronics Mart India Ltd,,,,,,,Excellent Wires and Packaging Ltd,Khandwala Securities Ltd,Godavari Biorefineries Ltd,,,Vodafone Idea Ltd,Avi Ansh Textile Ltd,,Bansal Multiflex Ltd,,,,
15,,,Jaykay Enterprises Ltd,Meghmani Organics Ltd,,,Som Distilleries & Breweries Ltd,Divgi Torqtransfer Systems Ltd,SML ISUZU Ltd,,Federal Bank Ltd,,,UltraTech Cement Ltd,Quadrant Future Tek Ltd,Eon Electric Ltd,Elecon Engineering Company Ltd,,Harig Crankshafts Ltd,Kesoram Industries Ltd Partly Paidup,,,Archean Chemical Industries Ltd,,,Excel Realty N Infra Ltd,Epack Durable Ltd,,,,,RBZ Jewellers Ltd,,,,Net Avenue Technologies Ltd,,,,,Chennai Petroleum Corporation Ltd,Ishan International Ltd,Eros International Media Ltd,,Colgate-Palmolive (India) Ltd,,Nova Agritech Ltd,Aravali Securities & Finance Ltd,,,Devyani International Ltd,,,,,,Kaya Ltd,,India Tourism Development Corporation Ltd,Sheela Foam Ltd,,Aurionpro Solutions Ltd,BGR Energy Systems Ltd,Sustainable Energy Infra Trust,,,DRS Cargo Movers Ltd,,Zee Media Corporation Ltd,Owais Metal and Mineral Processing Ltd,Crayons Advertising Ltd,Indostar Capital Finance Ltd,MMP Industries Ltd,,Power Grid Corporation of India Ltd,Flexituff Ventures International Ltd,,Pudumjee Paper Products Ltd,,Amrutanjan Health Care Ltd,Norben Tea & Exports Ltd,Jain Irrigation Systems Ltd,,KSK Energy Ventures Ltd,,,,,Zodiac Clothing Company Ltd,,Coromandel Engineering Company Ltd,,,,Entero Healthcare Solutions Ltd,,,,,,,Gallantt Ispat Ltd,Monarch Networth Capital Ltd,Indian Sucrose Ltd,,,,Axita Cotton Ltd,,Bhalchandram Clothing Ltd,,,,
16,,,Kavveri Defence & Wireless Technologies Ltd,NACL Industries Ltd,,,Sula Vineyards Ltd,Endurance Technologies Ltd,Tata Motors Ltd,,Fino Payments Bank Ltd,,,NTPC Ltd,R R Kabel Ltd,Exicom Tele-Systems Ltd,Elgi Equipments Ltd,,Hilton Metal Forging Ltd,Mangalam Cement Ltd,,,Arvee Laboratories (India) Ltd,,,Fedders Electric & Engineering Ltd,Eureka Forbes Ltd,,,,,Renaissance Global Ltd,,,,Nureca Ltd,,,,,Inox Green Energy Services Ltd,KRN Heat Exchanger and Refrigeration Ltd,GTPL Hathway Ltd,,Cupid Ltd,,Paradeep Phosphates Ltd,Arman Financial Services Ltd,,,Hatsun Agro Products Ltd,,,,,,Kovai Medical Center & Hospital Ltd,,Indian Hotels Co Ltd,VIP Industries Ltd,,Aurum PropTech Ltd Partly Paidup,Bharat Road Network Ltd,,,,DRS Dilip Roadlines Ltd,,,Rajnandini Metal Ltd,Crown Lifters Ltd,Mahindra & Mahindra Financial Services Ltd,National Aluminium Company Ltd,,Canara Bank,Garware Hi Tech Films Ltd,,Rainbow Papers Ltd,,Anuh Pharma Ltd,Peria Karamalai Tea & Produce Company Ltd,Kingfa Science & Technology (India) Ltd,,NHPC Ltd,,,,,,,Country Condos Ltd,,,,Ethos Ltd,,,,,,,Gandhi Special Tubes Ltd,Motilal Oswal Financial Services Ltd,KCP Sugar & Industries Corporation Ltd,,,,AYM Syntex Ltd,,Bombay Metrics Supply Chain Ltd,,,,
17,,,Krishna Defence & Allied Industries Ltd,P I Industries Ltd,,,Tilaknagar Industries Ltd,Exide Industries Ltd,Tunwal E-Motors Ltd,,HDFC Bank Ltd,,,Titan Company Ltd,Sterlite Technologies Ltd,Focus Lighting & Fixtures Ltd,Energy-Mission Machineries (India) Ltd,,Kalyani Forge Ltd,NCL Industries Ltd,,,Asahi Songwon Colors Ltd,,,Garuda Construction and Engineering Ltd,Euro Multivision Ltd,,,,,Senco Gold Ltd,,,,One 97 Communications Ltd,,,,,Gulf Oil Lubricants India Ltd,LMW Ltd,Identical Brains Studios Ltd,,Dabur India Ltd,,Rashtriya Chemicals & Fertilizers Ltd,Ascom Leasing & Investments Ltd,,,Bikaji Foods International Ltd,,,,,,Krishna Institute of Medical Sciences Ltd,,ITC Hotels Ltd,,,Aurum Proptech Ltd,Ceigall India Ltd,,,,Future Supply Chain Solutions Ltd,,,Resurgere Mines & Minerals India Ltd,Delta Corp Ltd,Manappuram Finance Ltd,Pondy Oxides & Chemicals Ltd,,UCO Bank,Hindustan Tin Works Ltd,,Ruchira Papers Ltd,,Astrazeneca Pharma India Ltd,Pix Transmission Ltd,Kriti Industries (India) Ltd,,NLC India Ltd,,,,,,,D S Kulkarni Developers Ltd,,,,Foce India Ltd,,,,,,,Geekay Wires Ltd,Nuvama Wealth Management Ltd,Kesar Enterprises Ltd,,,,Bannari Amman Spinning Mills Ltd,,Cello World Ltd,,,,
18,,,Mazagon Dock Shipbuilders Ltd,Punjab Chemicals & Crop Protection Ltd,,,United Breweries Ltd,Federal-Mogul Goetze (India) Ltd,TVS Motor Company Ltd,,Indian Overseas Bank,,,Tata Motors Ltd,Tamil Nadu Telecommunications Ltd,GE Vernova T&D India Ltd,Envair Electrodyne Ltd,,Kennametal India Ltd,Nihon Nirmaan Ltd,,,Atul Ltd,,,Gayatri Projects Ltd,Genus Power Infrastructures Ltd,,,,,Shukra Jewellery Ltd,,,,One Mobikwik Systems Ltd,,,,,Indraprastha Medical Corporation Ltd,Macpower CNC Machines Ltd,Imagicaaworld Entertainment Ltd,,Dangee Dums Ltd,,Rama Phosphates Ltd,ATN International Ltd,,,LT Foods Ltd,,,,,,Krsnaa Diagnostics Ltd,,Juniper Hotels Ltd,,,AXISCADES Technologies Ltd,Chamunda Electrical Ltd,,,,Gateway Distriparks Ltd,,,Rohit Ferro Tech Ltd,Dhruv Consultancy Services Ltd,Motor & General Finance Ltd,Precision Wires India Ltd,,General Insurance Corporation of India,Hitech Corporation Ltd,,South India Paper Mills Ltd,,Aurobindo Pharma Ltd,Rossell India Ltd,Kshitij Polyline Ltd,,NTPC Ltd,,,,,,,DLF Ltd,,,,Fonebox Retail Ltd,,,,,,,Godawari Power & Ispat Ltd,Prudent Corporate Advisory Services Ltd,KM Sugar Mills Ltd,,,,Banswara Syntex Ltd,,Compuage Infocom Ltd,,,,
19,,,Mishra Dhatu Nigam Ltd,Rallis India Ltd,,,United Spirits Ltd,Fiem Industries Ltd,Urja Global Ltd,,ICICI Bank Ltd,,,Power Grid Corporation of India Ltd,Telephone Cables Ltd,GP Eco Solutions India Ltd,Esab India Ltd,,Lakshmi Precision Screws Ltd,Nuvoco Vistas Corporation Ltd,,,Balaji Amines Ltd,,,Generic Engineering Construction & Projects Ltd,Global Surfaces Ltd,,,,,Silgo Retail Ltd,,,,RNFI Services Ltd,,,,,Deep Industries Ltd,Mamata Machinery Ltd,Inox Leisure Ltd,,Dhanlaxmi Crop Science Ltd,,Southern Petrochemicals Industries Corporation Ltd,Authum Investment & Infrastructure Ltd,,,Westlife Foodworld Ltd,,,,,,Laxmi Dental Ltd,,Kamat Hotels (India) Ltd,,,Bartronics India Ltd,Dilip Buildcon Ltd,,,,Globe International Carriers Ltd,,,Sandur Manganese & Iron Ores Ltd,Dreamfolks Services Ltd,Muthoot Capital Services Ltd,Rajputana Industries Ltd,,Union Bank of India,Huhtamaki India Ltd,,Satia Industries Ltd,,Bafna Pharmaceuticals Ltd,Rubfila International Ltd,Mahindra EPC Irrigation Ltd,,NTPC Green Energy Ltd,,,,,,,Eldeco Housing & Industries Ltd,,,,Future Enterprises-DVR,,,,,,,Goodluck India Ltd,SMC Global Securities Ltd,Kothari Sugars & Chemicals Ltd,,,,Bhandari Hosiery Exports Ltd,,Continental Seeds and Chemicals Ltd,,,,
20,,,MTAR Technologies Ltd,Sharda Cropchem Ltd,,,,Gabriel India Ltd,VST Tillers Tractors Ltd,,IDBI Bank Ltd,,,Adani Ports & Special Economic Zone Ltd,Universal Cables Ltd,Hitachi Energy India Ltd,Felix Industries Ltd,,LGB Forge Ltd,Orient Cement Ltd,,,BASF India Ltd,,,JMC Projects (India) Ltd,Greenchef Appliances Ltd,,,,,Sky Gold Ltd,,,,Suvidhaa Infoserve Ltd,,,,,Hindustan Oil Exploration Company Ltd,Marshall Machines Ltd,Inspire Films Ltd,,Dodla Dairy Ltd,,Zuari Agro Chemicals Ltd,Avonmore Capital & Management Services Ltd,,,Sapphire Foods India Ltd,,,,,,Lotus Eye Hospital & Institute Ltd,,Kaushalya Infrastructure Development Corpn Ltd,,,Bharatiya Global Infomedia Ltd,Ducon Infratechnologies Ltd,,,,Jalan Transolutions (India) Ltd,,,Shirpur Gold Refinery Ltd,Dredging Corporation of India Ltd,Muthoot Finance Ltd,Ram Ratna Wires Ltd,,Ircon International Ltd,Ideal Technoplast Industries Ltd,,Seshasayee Paper & Boards Ltd,,Bajaj Healthcare Ltd,Sampann Utpadan India Ltd,Master Components Ltd,,Orient Green Power Company Ltd,,,,,,,Elnet Technologies Ltd,,,,Future Enterprises Ltd,,,,,,,Grand Foundry Ltd,Steel City Securities Ltd,M.V.K. Agro Food Product Ltd,,,,Birla Cotsyn India Ltd,,DC Infotech & Communication Ltd,,,,
21,,,NIBE Ltd,Shivalik Rasayan Ltd,,,,GNA Axles Ltd,,,IDFC First Bank Ltd,,,Coal India Ltd,V-Marc India Ltd,Honda India Power Products Ltd,GMM Pfaudler Ltd,,M M Forgings Ltd,Panyam Cements & Mineral Industries Ltd,,,Bhageria Industries Ltd,,,Jaiprakash Associates Ltd,Havells India Ltd,,,,,Tribhovandas Bhimji Zaveri Ltd,,,,Swiggy Ltd,,,,,Confidence Petroleum India Ltd,Megatherm Induction Ltd,Jain Studios Ltd,,Emami Ltd,,,Baid Finserv Ltd,,,Mrs. Bectors Food Specialities Ltd,,,,,,Maitreya Medicare Ltd,,Lemon Tree Hotels Ltd,,,Birlasoft Ltd,Effwa Infra & Research Ltd,,,,Jet Freight Logistics Ltd,,,South West Pinnacle Exploration Ltd,DU DIgital Global Ltd,Nagreeka Capital & Infrastructure Ltd,Sagardeep Alloys Ltd,,Central Bank of India,Inox India Ltd,,Shreyans Industries Ltd,,Bal Pharma Ltd,Somi Conveyor Beltings Ltd,Mold-Tek Packaging Ltd Partly Paidup,,Power Grid Corporation of India Ltd,,,,,,,Elpro International Ltd,,,,Future Lifestyle Fashions Ltd,,,,,,,Hariom Pipe Industries Ltd,Wealth First Portfolio Managers Ltd,Magadh Sugar & Energy Ltd,,,,Blue Blends (India) Ltd,,De Neers Tools Ltd,,,,
22,,,Paras Defence and Space Technologies Ltd,Sikko Industries Ltd,,,,Goldstar Power Ltd,,,Indian Bank,,,Bajaj Auto Ltd,,HPL Electric & Power Ltd,Graphite India Ltd,,Metalyst Forgings Ltd,Prism Johnson Ltd,,,Bodal Chemicals Ltd,,,Mahindra Lifespace Developers Ltd,Hawkins Cookers Ltd,,,,,Thangamayil Jewellery Ltd,,,,TBO Tek Ltd,,,,,,Perfect Infraengineers Ltd Partly Paidup,KSS Ltd,,Euro India Fresh Foods Ltd,,,Bajaj Finance Ltd,,,CCL Products India Ltd,,,,,,Max Healthcare Institute Ltd,,Mahindra Holidays & Resorts India Ltd,,,Black Box Ltd,EMS Ltd,,,,Lancer Containers Lines Ltd,,,Sunlite Recycling Industries Ltd,Dynamic Services & Security Ltd,Nahar Capital & Financial Services Ltd,Shera Energy Ltd,,Bank of Maharashtra,Jumbo Bag Ltd,,Star Paper Mills Ltd,,Balaxi Pharmaceuticals Ltd,Tata Consumer Products Ltd,MPL Plastics Ltd,,Prabha Energy Ltd,,,,,,,Emami Realty Ltd,,,,Future Retail Ltd,,,,,,,Hisar Metal Industries Ltd,,Mawana Sugars Ltd,,,,Bombay Dyeing & Manufacturing Company Ltd,,Debock Industries Ltd,,,,
23,,,Rossell Techsys Ltd,Sumitomo Chemical India Ltd,,,,Harsha Engineers International Ltd,,,IndusInd Bank Ltd,,,JSW Steel Ltd,,ICE Make Refrigeration Ltd,Greaves Cotton Ltd,,Nelcast Ltd,Sagar Cements Ltd,,,Camlin Fine Sciences Ltd,,,Man Infraconstruction Ltd,Hind Rectifiers Ltd,,,,,Titan Company Ltd,,,,Vasa Denticity Ltd,,,,,,Presstonic Engineering Ltd,Maxposure Ltd,,Foods & Inns Ltd,,,Bajaj Finserv Ltd,,,Avanti Feeds Ltd,,,,,,Metropolis Healthcare Ltd,,Oriental Hotels Ltd,,,BLS E-Services Ltd,Engineers India Ltd,,,,Mahindra Logistics Ltd,,,Vedanta Ltd,E Factor Experiences Ltd,NBI Industrial Finance Company Ltd,Shivalik Bimetal Controls Ltd,,Bank of India,Kanpur Plastipack Ltd,,Tamil Nadu Newsprint & Papers Ltd,,Beta Drugs Ltd,United Nilgiri Tea Estates Company Ltd,Nilkamal Ltd,,RattanIndia Power Ltd,,,,,,,Eurotex Industries and Exports Ltd,,,,Heads UP Ventures Ltd,,,,,,,Hi-Tech Pipes Ltd,,Ponni Sugars (Erode) Ltd,,,,Bombay Rayon Fashions Ltd,,Dhariwalcorp Ltd,,,,
24,,,Solar Industries India Ltd,UPL Ltd,,,,HBL Engineering Ltd,,,Jammu and Kashmir Bank Ltd,,,Asian Paints Ltd,,Igarashi Motors India Ltd,Grindwell Norton Ltd,,Paramount Speciality Forgings Ltd,Sanghi Industries Ltd,,,Castrol India Ltd,,,Manjeera Constructions Ltd,IFB Industries Ltd,,,,,Utssav CZ Gold Jewels Ltd,,,,Wise Travel India Ltd,,,,,,Readymix Construction Machinery Ltd,Media Matrix Worldwide Ltd,,Freshara Agro Exports Ltd,,,Bajaj Holdings & Investment Ltd,,,Dodla Dairy Ltd,,,,,,Mohini Health & Hygiene Ltd,,Robust Hotels Ltd,,,BLS International Services Ltd,Enviro Infra Engineers Ltd,,,,Marinetrans India Ltd,,,Vishnusurya Projects and Infra Ltd,Ecos (India) Mobility & Hospitality Ltd,PTC India Ltd,,,Cochin Shipyard Ltd,Mega Flex Plastics Ltd,,West Coast Paper Mills Ltd,,Biocon Ltd,,Niraj Ispat Industries Ltd,,Reliance Power Ltd,,,,,,,Forbes & Company Ltd,,,,Hindware Home Innovation Ltd,,,,,,,Incredible Industries Ltd,,Rajshree Sugars & Chemicals Ltd,,,,BSL Ltd,,Dhunseri Ventures Ltd,,,,
25,,,Taneja Aerospace & Aviation Ltd,UPL Ltd Partly Paidup,,,,Hindustan Composites Ltd,,,Jana Small Finance Bank Ltd,,,Nestle India Ltd,,IKIO Lighting Ltd,Gujarat Apollo Industries Ltd,,Pattech Fitwell Tube Components Ltd,Saurashtra Cement Ltd,,,Chembond Chemicals Ltd,,,Marg Ltd,Interiors & More Ltd,,,,,Vaibhav Global Ltd,,,,Womancart Ltd,,,,,,Revathi Equipment India Ltd,Mukta Arts Ltd,,Gillette India Ltd,,,Bajaj Housing Finance Ltd,,,KRBL Ltd,,,,,,Narayana Hrudayalaya Ltd,,Royal Orchid Hotels Ltd,,,Blue Star Infotech Ltd,G R Infraprojects Ltd,,,,Navkar Corporation Ltd,,,,Eleganz Interiors Ltd,PNB Gilts Ltd,,,Punjab & Sind Bank,Mold-Tek Packaging Ltd,,,,Biofil Chemicals & Pharmaceuticals Ltd,,Pearl Polymers Ltd,,SJVN Ltd,,,,,,,Ganesh Housing Corporation Ltd,,,,HP Telecom India Ltd,,,,,,,India Steel Works Ltd,,Rana Sugars Ltd,,,,Cantabil Retail India Ltd,,D-Link India Ltd,,,,
26,,,Unimech Aerospace and Manufacturing Ltd,,,,,India Motor Parts & Accessories Ltd,,,Karnataka Bank Ltd,,,Bharat Electronics Ltd,,IMP Powers Ltd,HEG Ltd,,Pritika Engineering Components Ltd,Shree Digvijay Cement Co. Ltd,,,Chemcon Speciality Chemicals Ltd,,,Nila Infrastructures Ltd,Johnson Controls-Hitachi Air Condition. India Ltd,,,,,Winsome Diamonds & Jewellery Ltd,,,,Yaari Digital Integrated Services Ltd,,,,,,Singer India Ltd,Music Broadcast Ltd,,GKB Ophthalmics Ltd,,,Beacon Trusteeship Ltd,,,Hindustan Foods Ltd,,,,,,Nephro Care India Ltd,,Saj Hotels Ltd,,,Bodhtree Consulting Ltd,Ganesh Green Bharat Ltd,,,,North Eastern Carrying Corpor. Ltd Partly Paidup,,,,EMA Partners India Ltd,Poonawalla Fincorp Ltd,,,Indian Overseas Bank,Nahar Polyfilms Ltd,,,,Bliss GVS Pharma Ltd,,Pil Italica Lifestyle Ltd,,Surana Telecom and Power Ltd,,,,,,,Geecee Ventures Ltd,,,,Jay Jalaram Technologies Ltd,,,,,,,Interarch Building Products Ltd,,Sakthi Sugars Ltd,,,,Celebrity Fashions Ltd,,Eastcoast Steel Ltd,,,,
27,,,Zen Technologies Ltd,,,,,India Nippon Electricals Ltd,,,Karur Vysya Bank Ltd,,,Tech Mahindra Ltd,,Indo Tech Transformers Ltd,Hercules Hoists Ltd,,PTC Industries Ltd,Shree Cement Ltd,,,Chemfab Alkalis Ltd,,,Pansari Developers Ltd,Kaynes Technology India Ltd,,,,,Zodiac-JRD-MKJ Ltd,,,,Yatra Online Ltd,,,,,,Skipper Ltd,Next Mediaworks Ltd,,GlaxoSmithkline Consumer Healthcare Ltd(Merged),,,BF Investment Ltd,,,Heritage Foods Ltd,,,,,,Nidan Laboratories & Healthcare Ltd,,Samhi Hotels Ltd,,,Brightcom Group Ltd,Ganesh Infraworld Ltd,,,,North Eastern Carrying Corporation Ltd,,,,Embassy Developments Ltd,Sastasundar Ventures Ltd,,,Indian Bank,Neo Corp International Ltd,,,,Blue Jet Healthcare Ltd,,Polysil Irrigation Systems Ltd,,Tata Power Company Ltd,,,,,,,Godrej Properties Ltd,,,,JHS Svendgaard Retail Ventures Ltd,,,,,,,Jai Balaji Industries Ltd,,Shree Renuka Sugars Ltd,,,,Century Enka Ltd,,Future Consumer Ltd,,,,
28,,,,,,,,IP Rings Ltd,,,Kotak Mahindra Bank Ltd,,,Tata Steel Ltd,,Indosolar Ltd,HLE Glascoat Ltd,,Ramkrishna Forgings Ltd,Star Cement Ltd,,,Chemplast Sanmar Ltd,,,Parsvnath Developers Ltd,KDDL Ltd,,,,,,,,,Zomato Ltd,,,,,,Skipper Ltd Partly Paidup,Ortel Communications Ltd,,Godrej Agrovet Ltd,,,Blue Chip India Ltd,,,ADF Foods Ltd,,,,,,Opto Circuits (India) Ltd,,Savera Industries Ltd,,,C.E. Info Systems Ltd,Gayatri Highways Ltd,,,,OneClick Logistics India Ltd,,,,FGP Ltd,SBI Cards and Payment Services Ltd,,,Oil And Natural Gas Corporation Ltd,Oricon Enterprises Ltd,,,,Brooks Laboratories Ltd,,Prakash Pipes Ltd,,Torrent Power Ltd,,,,,,,Golden Tobacco Ltd,,,,KKV Agro Powers Ltd,,,,,,,Jay Bee Laminations Ltd,,Simbhaoli Sugars Ltd,,,,Cheviot Company Ltd,,Goldkart Jewels Ltd,,,,
29,,,,,,,,Jamna Auto Industries Ltd,,,Punjab & Sind Bank,,,Grasim Industries Ltd,,Inox Wind Ltd,Indef Manufacturing Ltd,,Rolex Rings Ltd,The Ramco Cements Ltd,,,Citurgia Biochemicals Ltd,,,Pratibha Industries Ltd,LEEL Electricals Ltd,,,,,,,,,,,,,,,Sona Machinery Ltd,Padmalaya Telefilms Ltd,,Godrej Consumer Products Ltd,,,BSEL ALGO Ltd,,,Prataap Snacks Ltd,,,,,,Poly Medicure Ltd,,Sayaji Hotels Ltd,,,Cadsys (India) Ltd,GE Power India Ltd,,,,Orissa Bengal Carrier Ltd,,,,Fishing Falcons Ltd,SIL Investments Ltd,,,Punjab National Bank,Orient Press Ltd,,,,Caplin Point Laboratories Ltd,,Premier Polyfilm Ltd,,Ushdev International Ltd,,,,,,,Housing Development & Infrastructure Ltd,,,,Landmark Cars Ltd,,,,,,,Jayaswal Neco Industries Ltd,,Thiru Arooran Sugars Ltd,,,,CLC Industries Ltd,,Goyal Aluminiums Ltd,,,,
30,,,,,,,,Jay Bharat Maruti Ltd,,,Punjab National Bank,,,Eicher Motors Ltd,,Jyoti Structures Ltd,Ingersoll-Rand (India) Ltd,,Sharp Chucks and Machines Ltd,Udaipur Cement Works Ltd,,,Clean Science & Technology Ltd,,,PSP Projects Ltd,Madhav Marbles and Granites Ltd,,,,,,,,,,,,,,,Techera Engineering India Ltd,Phantom Digital Effects Ltd,,Gopal Snacks Ltd,,,Can Fin Homes Ltd,,,Agro Tech Foods Ltd,,,,,,Rainbow Childrens Medicare Ltd,,Sinclairs Hotels Ltd,,,California Software Company Ltd Partly Paidup,Gensol Engineering Ltd,,,,Patel Integrated Logistics Ltd Partly Paidup,,,,Future Market Networks Ltd,Spandana Sphoorty Financial Ltd,,,NTPC Ltd,Polyplex Corporation Ltd,,,,Cipla Ltd,,Prince Pipes & Fittings Ltd,,,,,,,,,Hemisphere Properties India Ltd,,,,Magson Retail and Distribution Ltd,,,,,,,Jindal Saw Ltd,,Triveni Engineering and Industries Ltd,,,,Damodar Industries Ltd,,Gretex Industries Ltd,,,,
31,,,,,,,,JBM Auto Ltd,,,RBL Bank Ltd,,,Hindalco Industries Ltd,,Kirloskar Electric Company Ltd,Jash Engineering Ltd,,Simplex Castings Ltd,UltraTech Cement Ltd,,,Dai-ichi Karkaria Ltd,,,Punj Lloyd Ltd,Mangalam Timber Products Ltd,,,,,,,,,,,,,,,Tega Industries Ltd,Picturepost Studios Ltd,,Goyal Salt Ltd,,,Capital Trust Ltd,,,Parag Milk Foods Ltd,,,,,,Sangani Hospitals Ltd,,Speciality Restaurants Ltd,,,California Software Company Ltd,Giriraj Civil Developers Ltd,,,,Patel Integrated Logistics Ltd,,,,Ganesh Benzoplast Ltd,Shriram Finance Ltd,,,Indian Oil Corporation Ltd,Pyramid Technoplast Ltd,,,,Concord Biotech Ltd,,R M Drip & Sprinklers Systems Ltd,,,,,,,,,Homesfy Realty Ltd,,,,Medplus Health Services Ltd,,,,,,,Jindal Stainless Ltd,,Ugar Sugar Works Ltd,,,,DCM Nouvelle Ltd,,Gujarat Cotex Ltd,,,,
32,,,,,,,,JTEKT India Ltd,,,South Indian Bank Ltd,,,HDFC Life Insurance Company Ltd,,Kundan Edifice Ltd,JNK India Ltd,,Steelcast Ltd,,,,DDev Plastiks Industries Ltd,,,RBM Infracon Ltd,MIC Electronics Ltd,,,,,,,,,,,,,,,The Anup Engineering Ltd,Prime Focus Ltd,,GRM Overseas Ltd,,,Capri Global Capital Ltd,,,Chaman Lal Setia Exports Ltd,,,,,,Shalby Ltd,,Sri Havisha Hospitality & Infrastructure Ltd,,,Cambridge Technology Enterprises Ltd,GMR Power & Urban Infra Ltd,,,,Pranik Logistics Ltd,,,,GMR Airports Ltd,Sundaram Finance Ltd,,,Coal India Ltd,Rajshree Polypack Ltd,,,,Dishman Carbogen Amcis Ltd,,Responsive Industries Ltd,,,,,,,,,Hubtown Ltd,,,,On Door Concepts Ltd,,,,,,,Jindal Steel & Power Ltd,,Uttam Sugar Mills Ltd,,,,Deepak Spinners Ltd,,Hardwyn India Ltd,,,,
